"Title","Genres","Description","GameFAQs_Reader_Rating","GameFAQs_Rating","MetaCritics_MetaScore","Developer","ReleaseDate","ReferenceURL",
"Shanghai III: Dragon's Eye","Miscellaneous,Puzzle,General","Shanghai III: Dragon's Eye is a Miscellaneous game, published by ASK,which was released in Japan in 1992.","n/a","n/a","n/a","ASK","Dec 18, 1992 ","http://www.gamefaqs.com/turbocd/589209-shanghai-iii-dragons-eye"
"Shapeshifter: Makai Eiyuuden","Role-Playing,Action RPG","Shapeshifter: Makai Eiyuuden is a Role-Playing game, developed by ICOM Simulations and published by Victor Interactive Software,which was released in Japan in 1992.","9.0","6.0","n/a","ICOM Simulations","1993 ","http://www.gamefaqs.com/turbocd/563793-shapeshifter-makai-eiyuuden"
"Shapeshifter: Makai Eiyuuden","Role-Playing,Action RPG","Shapeshifter: Makai Eiyuuden is a Role-Playing game, developed by ICOM Simulations and published by Victor Interactive Software,which was released in Japan in 1992.","9.0","6.0","n/a","ICOM Simulations","1993 ","http://www.gamefaqs.com/turbocd/563793-shapeshifter-makai-eiyuuden"
"Sherlock Holmes Consulting Detective","Adventure,General","Sherlock Holmes Consulting Detective is an Adventure game, developed by ICOM Simulations and published by Victor Interactive Software,which was released in Japan in 1991.","3.5","7.0","n/a","ICOM Simulations","1991 ","http://www.gamefaqs.com/turbocd/563796-sherlock-holmes-consulting-detective"
"Sherlock Holmes Consulting Detective Volume 2","Adventure,General","Old London is the setting once again as we join Mr. Sherlock Holmes and his able assistant Dr. John Watson in 3 new mysteries of murder, money and missing art that will test your skill, your intelligence, and your patience. All the tools, clues, and witnesses you need to solve the crimes are locked within each intriguing storyline. Use your best detective skills to find the key and unlock the truth behind each case. Be careful, the wrong clues will guide you away from the truth, and cost you valuable points. Are you as good as Mr. Holmes, or better? We will soon see!","n/a","n/a","n/a","ICOM Simulations","1993 ","http://www.gamefaqs.com/turbocd/563797-sherlock-holmes-consulting-detective-volume-2"
"Sherlock Holmes Consulting Detective","Adventure,General","Sherlock Holmes Consulting Detective is an Adventure game, developed by ICOM Simulations and published by Victor Interactive Software,which was released in Japan in 1991.","3.5","7.0","n/a","ICOM Simulations","1991 ","http://www.gamefaqs.com/turbocd/563796-sherlock-holmes-consulting-detective"
"Sherlock Holmes Consulting Detective Volume 2","Adventure,General","Old London is the setting once again as we join Mr. Sherlock Holmes and his able assistant Dr. John Watson in 3 new mysteries of murder, money and missing art that will test your skill, your intelligence, and your patience. All the tools, clues, and witnesses you need to solve the crimes are locked within each intriguing storyline. Use your best detective skills to find the key and unlock the truth behind each case. Be careful, the wrong clues will guide you away from the truth, and cost you valuable points. Are you as good as Mr. Holmes, or better? We will soon see!","n/a","n/a","n/a","ICOM Simulations","1993 ","http://www.gamefaqs.com/turbocd/563797-sherlock-holmes-consulting-detective-volume-2"
"Shin Megami Tensei","Role-Playing,General","!WARNINGThis game is not translated and displays Japanese text only.Shin Megami Tensei (literally True Goddess Reincarnation) is a role-playing video game from Atlus that was originally released on October 30, 1992 in Japan.The game was extremely well received and would spawn a variety of sequels and spin offs.PLOTThe story is set in Tokyo in the year 199X. Demons from the nether-realm of Makai have found their way back to Earth, and as such have upset the balance of power. A charismatic Japanese leader attempts a coup d'&eacute;tat using these demons as a potent military force, forcing America to intervene with its military. The player, as the hero, becomes involved when sent a Devil Summoning Program via email which allows him to converse with and recruit demons to fight for him, storing them as digital data on his computer.In the aftermath of the ensuing destruction, the hero must decide what kind of world should be created on its ruins. Will he side with the angels and create a kingdom of absolute order that would last for a thousand years, or will he side with the demons and bring about an eternal anarchy, or will he choose neither, and destroy everyone who opposes him?GAMEPLAYThe game features two types of characters: Humans and Demons. A key facet of game play involves collecting demons. The human Hero acquires these demons via negotiation, bribing and coercion during battle. Once acquired, they can be stored in the party's portable computer and summoned for a small amount of money to be used in battle, and a constant feed of Magnetite (a secondary currency in the game) to be maintained outside of combat. If a demon is defeated during a battle, they must be revived before they can be used again.A notable aspect of the game is that the player can combine two or three demons and create a more powerful demon.HUMANS:Human characters can equip firearms with special ammo, melee weapons, and multiple pieces of armor from helmet to boots, although certain weapons can only be wielded by a character of a specific alignment. Humans are also the only ones capable of leveling up and having their Stats upgraded at the discretion of the player.DEMONS:There are a wide variety of demons from various mythologies in Shin Megami Tensei; each has its own unique statistics, and a skillset of up to three abilities or spells.!WARNINGThis game is not translated and displays Japanese text only.","n/a","7.7","n/a","Opera House","Dec 25, 1993 ","http://www.gamefaqs.com/turbocd/563799-shin-megami-tensei"
"Shin Nippon Pro Wrestling '94: Battlefield in Tokyo Dome","Action,Fighting,Wrestling","Shin Nippon Pro Wrestling '94: Battlefield in Tokyo Dome is an Action game, published by Fujicom,which was released in Japan in 1994.","2.0","n/a","n/a","Fujicom","Nov 25, 1994 ","http://www.gamefaqs.com/turbocd/589211-shin-nippon-pro-wrestling-94-battlefield-in-tokyo"
"Shin Onryu Senki","Adventure,General","Shin Onryu Senki is an Adventure game, developed and published by Fujicom,which was released in Japan in 1995.","n/a","n/a","n/a","Fujicom","Sep 22, 1995 ","http://www.gamefaqs.com/turbocd/563798-shin-onryu-senki"
"Shogi Database Kiyuu","Miscellaneous,Board Games","Shogi Database Kiyuu is a Miscellaneous game, developed by Random House and published by Seta Corporation,which was released in Japan in 1995.","n/a","n/a","n/a","Random House","Oct 27, 1995 ","http://www.gamefaqs.com/turbocd/916064-shogi-database-kiyuu"
"SimEarth: The Living Planet","Strategy,Breeding/Constructing","SimEarth: The Living Planet is a Strategy game, developed and published by Hudson,which was released in Japan in 1993.","n/a","7.2","","","","http://www.gamefaqs.com/turbocd/563803-simearth-the-living-planet"
"Slime World","Action,General","Slime World is an Action game, developed by I.S.C. and published by Micro World,which was released in Japan in 1992.","n/a","n/a","n/a","I.S.C.","Oct9, 1992 ","http://www.gamefaqs.com/turbocd/563804-slime-world"
"Slot Gambler","Miscellaneous,Parlor,Gambling","Slot Gambler is a Miscellaneous game, published by Nichibutsu,which was released in Japan in 1995.","n/a","n/a","n/a","Nichibutsu","Apr 28, 1995 ","http://www.gamefaqs.com/turbocd/563805-slot-gambler"
"Snatcher CD-ROMantic","Adventure,First-Person,Sci-Fi","A.D. 2047. Neo Kobe City, Japan, a place of madness and decadence... A mysterious Bio-roid life form has appeared. Its true nature and purpose are unknown. Is it some country's secret weapon, or an alien from another world? They slay their victims and take their place, earning them the nickname &quot;SNATCHERS.&quot; A new police division - J.U.N.K.E.R.s - has been formed. They are trained specifically to combat the SNATCHERS. The fate of mankind hangs in the balance. The war between the SNATCHERS and J.U.N.K.E.R.s has begun!","8.5","8.3","n/a","Konami","Oct 23, 1992 ","http://www.gamefaqs.com/turbocd/563806-snatcher-cd-romantic"
"Snatcher Pilot Disk","Miscellaneous,General","Snatcher Pilot Disk is a Miscellaneous game, developed and published by Konami,which was released in Japan in 1992.","7.0","n/a","n/a","Konami","Aug7, 1992 ","http://www.gamefaqs.com/turbocd/916091-snatcher-pilot-disk"
"Sol Bianca","Role-Playing,General","Sol Bianca is a Role-Playing game, published by NCS,which was released in Japan in 1990.","n/a","n/a","n/a","NCS","Jun 29, 1990 ","http://www.gamefaqs.com/turbocd/916092-sol-bianca"
"Sol: Moonarge","Role-Playing,General","Sol: Moonarge is a Role-Playing game, published by Irem,which was released in Japan in 1994.","n/a","n/a","n/a","Irem","Jan7, 1994 ","http://www.gamefaqs.com/turbocd/916093-sol-moonarge"
"Solid Force","Strategy,Breeding/Constructing","Solid Force is a Strategy game, developed by Kogado Studio and published by NEC Interchannel,which was released in Japan in 1995.","n/a","n/a","n/a","Kogado Studio","Mar 17, 1995 ","http://www.gamefaqs.com/turbocd/916094-solid-force"
"Sorcerian","Role-Playing,Action RPG","Sorcerian is a Role-Playing game, developed by Pegasus Japan and published by Victor Interactive Software,which was released in Japan in 1992.","n/a","8.0","n/a","Pegasus Japan","Jul 17, 1992 ","http://www.gamefaqs.com/turbocd/916095-sorcerian"
"Sotsugyou","Strategy,Breeding/Constructing","Sotsugyou is a Strategy game, published by NEC Interchannel,which was released in Japan in 1993.","n/a","8.0","n/a","NEC Interchannel","Jul 30, 1993 ","http://www.gamefaqs.com/turbocd/916096-sotsugyou"
"Sotsugyou II","Strategy,Breeding/Constructing","Sotsugyou II is a Strategy game, published by River Hill Software,which was released in Japan in 1994.","n/a","n/a","n/a","River Hill Software","Dec 23, 1994 ","http://www.gamefaqs.com/turbocd/916097-sotsugyou-ii"
"Sotsugyou II","Strategy,Breeding/Constructing","Sotsugyou II is a Strategy game, published by River Hill Software,which was released in Japan in 1994.","n/a","n/a","n/a","River Hill Software","Dec 23, 1994 ","http://www.gamefaqs.com/turbocd/916097-sotsugyou-ii"
"Sotsugyou Shashin Miki","Adventure,General","Sotsugyou Shashin Miki is an Adventure game, published by Coconuts Japan,which was released in Japan in 1994.","n/a","6.0","n/a","Coconuts Japan","Oct 28, 1994 ","http://www.gamefaqs.com/turbocd/916098-sotsugyou-shashin-miki"
"Sotsugyou","Strategy,Breeding/Constructing","Sotsugyou is a Strategy game, published by NEC Interchannel,which was released in Japan in 1993.","n/a","8.0","n/a","NEC Interchannel","Jul 30, 1993 ","http://www.gamefaqs.com/turbocd/916096-sotsugyou"
"Space Fantasy Zone","Action,Shooter,Rail","Space Fantasy Zone is an Action game, developed and published by NEC Avenue,which was cancelled before it was released.","","","","","","http://www.gamefaqs.com/turbocd/711046-space-fantasy-zone"
"Space Invaders: The Original Game","Action,Shooter,Static","Space Invaders: The Original Game is an Action game, published by NEC Interchannel,which was released in Japan in 1995.","n/a","n/a","n/a","NEC Interchannel","Jul 28, 1995 ","http://www.gamefaqs.com/turbocd/916099-space-invaders-the-original-game"
"Splash Lake","Miscellaneous,Puzzle,General","Splash Lake is a Miscellaneous game, developed by Bits Laboratory and published by NEC Interchannel,which was released in Japan in 1991.","n/a","8.0","n/a","Bits Laboratory","1992 ","http://www.gamefaqs.com/turbocd/916100-splash-lake"
"Spriggan Mark 2: Re-Terraform Project","Action,Shooter,Scrolling","Spriggan Mark 2: Re-Terraform Project is an Action game, developed by Compile and published by Naxat Soft,which was released in Japan in 1992.","7.0","6.5","n/a","Compile","May1, 1992 ","http://www.gamefaqs.com/turbocd/916102-spriggan-mark-2-re-terraform-project"
"Star Breaker","Role-Playing,General","Star Breaker is a Role-Playing game, developed by Geo Factory and published by Ray Force,which was released in Japan in 1994.","n/a","6.0","n/a","Geo Factory","Feb 10, 1994 ","http://www.gamefaqs.com/turbocd/916103-star-breaker"
"Star Mobile","Miscellaneous,Puzzle,General","Star Mobile is a Miscellaneous game, developed by M.N.M Software and published by Naxat Soft,which was released in Japan in 1992.","n/a","n/a","n/a","M.N.M Software","Oct2, 1992 ","http://www.gamefaqs.com/turbocd/916104-star-mobile"
"Star Parodier","Action,Shooter,Scrolling","Star Parodier is an Action game, developed by Inter State and published by Hudson,which was released in Japan in 1992.","8.7","7.9","","","","http://www.gamefaqs.com/turbocd/916105-star-parodier"
"Startling Odyssey","Role-Playing,General","Startling Odyssey is a Role-Playing game, developed and published by Ray Force,which was released in Japan in 1993.","n/a","n/a","n/a","Ray Force","Oct 22, 1993 ","http://www.gamefaqs.com/turbocd/916106-startling-odyssey"
"Startling Odyssey II: Maryuu Sensou","Role-Playing,General","Startling Odyssey II: Maryuu Sensou is a Role-Playing game, developed by Geo Factory and published by Ray Force,which was released in Japan in 1994.","n/a","7.7","n/a","Geo Factory","Oct 21, 1994 ","http://www.gamefaqs.com/turbocd/916107-startling-odyssey-ii-maryuu-sensou"
"Steam-Heart's","Action,Shooter,Scrolling","Steam-Heart's is an Action game, developed by Giga and published by TGL,which was released in Japan in 1996.","n/a","7.7","","","","http://www.gamefaqs.com/turbocd/916109-steam-hearts"
"Strider Hiryu (1994)","Action,Platformer,2D","Stand by, Strider. Upon receiving your orders from the commander, you are dropped into the heart of Russia, armed with only your lightning-quick sword. Your task is to infiltrate the Red Army and return enemy secrets to your superiors. Your mission begins in Red Square, but after fighting off KGB attacks there, your clues lead you to the snow-capped mountains of Siberia to battle both the elements and the enemy. If you survive this icy test, your orders are to proceed south to the Lowlands where jungle tribes wait with spears and poison arrows. Now you must return to Moscow to face the Grand Master of the Red Army. It is vital that you get to him before he destroys you or the world will fall under Russian control. The free world relies on your success!","6.5","6.3","n/a","Dice","Sep 22, 1994 ","http://www.gamefaqs.com/turbocd/916110-strider-hiryu-1994"
"Summer Carnival '93: Nexzr Special","Action,Shooter,Scrolling","Summer Carnival '93: Nexzr Special is an Action game, developed by Inter State and published by Naxat Soft,which was released in Japan in 1993.","n/a","9.0","n/a","Inter State","Jul 23, 1993 ","http://www.gamefaqs.com/turbocd/563710-summer-carnival-93-nexzr-special"
"Super Air Zonk","Action,Shooter,Scrolling","Super Air Zonk is an Action game, developed by Dual and published by Hudson,which was released in Japan in 1993.","n/a","7.4","","","","http://www.gamefaqs.com/turbocd/916112-super-air-zonk"
"Super Albatross","Sports,Traditional,Golf,Sim","Super Albatross is a Sports game, developed by Laser Soft and published by Nippon Telenet,which was released in Japan in 1989.","n/a","n/a","n/a","Laser Soft","Sep 14, 1989 ","http://www.gamefaqs.com/turbocd/916113-super-albatross"
"Super CD-ROM2 Taiken Soft-shuu","Miscellaneous,General","Super CD-ROM2 Taiken Soft-shuu is a Miscellaneous game, published by Hudson,which was released in Japan in 1991.","n/a","n/a","n/a","Hudson","Dec 13, 1991 ","http://www.gamefaqs.com/turbocd/916115-super-cd-rom2-taiken-soft-shuu"
"Super Daisenryaku","Strategy,Turn-Based,Modern","Super Daisenryaku is a Strategy game, published by Micro Cabin,which was released in Japan in 1990.","n/a","8.0","n/a","Micro Cabin","Apr 27, 1990 ","http://www.gamefaqs.com/turbocd/579610-super-daisenryaku"
"Super Darius","Action,Shooter,Scrolling","Super Darius is an Action game, developed by Bits Laboratory and published by NEC Interchannel,which was released in Japan in 1990.","n/a","9.0","n/a","Bits Laboratory","Mar 16, 1990 ","http://www.gamefaqs.com/turbocd/916116-super-darius"
"Super Darius II","Action,Shooter,Scrolling","Super Darius II is an Action game, developed by A-Wave and published by NEC Interchannel,which was released in Japan in 1993.","9.0","9.4","","","","http://www.gamefaqs.com/turbocd/916117-super-darius-ii"
"Super Mahjong Taikai","Miscellaneous,Board Games","Super Mahjong Taikai is a Miscellaneous game, published by Koei,which was released in Japan in 1992.","n/a","n/a","n/a","Koei","Dec 28, 1992 ","http://www.gamefaqs.com/turbocd/916118-super-mahjong-taikai"
"Super Raiden","Action,Shooter,Scrolling","Super Raiden is an Action game, developed by AI and published by Hudson,which was released in Japan in 1992.","n/a","7.3","n/a","AI","Apr2, 1992 ","http://www.gamefaqs.com/turbocd/916121-super-raiden"
"Super Real Mahjong P II-III Custom","Miscellaneous,Board Games","Super Real Mahjong P II-III Custom is a Miscellaneous game, published by Naxat Soft,which was released in Japan in 1994.","n/a","n/a","n/a","Naxat Soft","Aug5, 1994 ","http://www.gamefaqs.com/turbocd/916122-super-real-mahjong-p-ii-iii-custom"
"Super Real Mahjong P IV Custom","Miscellaneous,Board Games","Super Real Mahjong P IV Custom is a Miscellaneous game, published by Naxat Soft,which was released in Japan in 1993.","n/a","n/a","n/a","Naxat Soft","Dec 17, 1993 ","http://www.gamefaqs.com/turbocd/916123-super-real-mahjong-p-iv-custom"
"Super Real Mahjong P V Custom","Miscellaneous,Board Games","Super Real Mahjong P V Custom is a Miscellaneous game, published by Naxat Soft,which was released in Japan in 1995.","n/a","n/a","n/a","Naxat Soft","Mar3, 1995 ","http://www.gamefaqs.com/turbocd/916124-super-real-mahjong-p-v-custom"
"Super Real Mahjong Special","Miscellaneous,Board Games","Super Real Mahjong Special is a Miscellaneous game, published by Naxat Soft,which was released in Japan in 1992.","n/a","n/a","n/a","Naxat Soft","Dec 18, 1992 ","http://www.gamefaqs.com/turbocd/916125-super-real-mahjong-special"
"Super Schwarzschild","Strategy,Breeding/Constructing","Super Schwarzschild is a Strategy game, published by Kogado Studio,which was released in Japan in 1991.","n/a","n/a","n/a","Kogado Studio","Dec6, 1991 ","http://www.gamefaqs.com/turbocd/916126-super-schwarzschild"
"Super Schwarzschild 2","Strategy,Breeding/Constructing","Super Schwarzschild 2 is a Strategy game, published by Kogado Studio,which was released in Japan in 1992.","n/a","n/a","n/a","Kogado Studio","Dec4, 1992 ","http://www.gamefaqs.com/turbocd/916127-super-schwarzschild-2"
"Sword Master","Strategy,Breeding/Constructing","Sword Master is a Strategy game, published by Right Stuff,which was released in Japan in 1993.","8.0","n/a","n/a","Right Stuff","Nov 19, 1993 ","http://www.gamefaqs.com/turbocd/916128-sword-master"
"Terraforming","Action,Shooter,Scrolling","Terraforming is an Action game, developed by Right Stuff and published by Naxat Soft,which was released in Japan in 1992.","6.0","7.4","n/a","Right Stuff","1993 ","http://www.gamefaqs.com/turbocd/916138-terraforming"
"Sylphia","Action,Shooter,Scrolling","Sylphia is an Action game, developed by Compile and published by Tonkin House,which was released in Japan in 1993.","n/a","8.3","","","","http://www.gamefaqs.com/turbocd/916129-sylphia"
"Tadaima Yuusha Boshuuchuu","Miscellaneous,Board Games","Tadaima Yuusha Boshuuchuu is a Miscellaneous game, published by Human Entertainment,which was released in Japan in 1993.","n/a","n/a","n/a","Human Entertainment","Nov 26, 1993 ","http://www.gamefaqs.com/turbocd/916130-tadaima-yuusha-boshuuchuu"
"Taiheiki","Strategy,Breeding/Constructing","Taiheiki is a Strategy game, developed by TOSE and published by Intec,which was released in Japan in 1991.","n/a","n/a","n/a","TOSE","Dec 13, 1991 ","http://www.gamefaqs.com/turbocd/916131-taiheiki"
"Tanjou Debut","Strategy,Breeding/Constructing","Tanjou Debut is a Strategy game, published by NEC Interchannel,which was released in Japan in 1994.","n/a","8.0","n/a","NEC Interchannel","Sep 22, 1994 ","http://www.gamefaqs.com/turbocd/916132-tanjou-debut"
"Tecmo World Cup Super Soccer","Sports,Traditional,Soccer,Sim","Tecmo World Cup Super Soccer is a Sports game, published by Media Rings,which was released in Japan in 1992.","n/a","n/a","n/a","Media Rings","Dec4, 1992 ","http://www.gamefaqs.com/turbocd/916133-tecmo-world-cup-super-soccer"
"Tekipaki Working Love","Adventure,General","Tekipaki Working Love is an Adventure game, developed by Studio Offside and published by NEC Interchannel,which was released in Japan in 1997.","n/a","n/a","n/a","Studio Offside","Mar 28, 1997 ","http://www.gamefaqs.com/turbocd/916134-tekipaki-working-love"
"Tenchi Muyou! Ryououki","Adventure,General","Tenchi Muyou! Ryououki is an Adventure game, published by NEC Interchannel,which was released in Japan in 1995.","n/a","7.7","n/a","NEC Interchannel","May 26, 1995 ","http://www.gamefaqs.com/turbocd/916135-tenchi-muyou-ryououki"
"Tenchi o Kurau","Action,Beat-'Em-Up","Tenchi o Kurau is an Action game, published by NEC Interchannel,which was released in Japan in 1994.","n/a","n/a","n/a","NEC Interchannel","Jun 17, 1994 ","http://www.gamefaqs.com/turbocd/589275-tenchi-o-kurau"
"Tengai Makyou II: Manji Maru","Role-Playing,General","Tengai Makyou II: Manji Maru is a Role-Playing game, developed by RED Entertainment and published by Hudson,which was released in Japan in 1992.","9.0","7.5","n/a","RED Entertainment","Mar 26, 1992 ","http://www.gamefaqs.com/turbocd/589286-tengai-makyou-ii-manji-maru"
"Tengai Makyou: Fuun Kabuki Den","Role-Playing,General","Tengai Makyou: Fuun Kabuki Den is a Role-Playing game, developed by RED Entertainment and published by Hudson,which was released in Japan in 1993.","n/a","10.0","n/a","RED Entertainment","Jul 10, 1993 ","http://www.gamefaqs.com/turbocd/589284-tengai-makyou-fuun-kabuki-den"
"Tengai Makyou: Ziria","Role-Playing,General","Tengai Makyou: Ziria is a Role-Playing game, developed by RED Entertainment and published by Hudson,which was released in Japan in 1989.","n/a","8.0","n/a","RED Entertainment","Jun 30, 1989 ","http://www.gamefaqs.com/turbocd/589285-tengai-makyou-ziria"
"Tenshi no Uta","Role-Playing,General","Tenshi no Uta is a Role-Playing game, published by Nippon Telenet,which was released in Japan in 1991.","n/a","6.0","n/a","Nippon Telenet","Oct 25, 1991 ","http://www.gamefaqs.com/turbocd/916136-tenshi-no-uta"
"Tenshi no Uta II: Datenshi no Sentaku","Role-Playing,General","Tenshi no Uta II: Datenshi no Sentaku is a Role-Playing game, published by Nippon Telenet,which was released in Japan in 1993.","n/a","7.0","n/a","Nippon Telenet","Mar 26, 1993 ","http://www.gamefaqs.com/turbocd/916137-tenshi-no-uta-ii-datenshi-no-sentaku"
"Terraforming","Action,Shooter,Scrolling","Terraforming is an Action game, developed by Right Stuff and published by Naxat Soft,which was released in Japan in 1992.","6.0","7.4","n/a","Right Stuff","1993 ","http://www.gamefaqs.com/turbocd/916138-terraforming"
"Tokimeki Memorial","Strategy,Breeding/Constructing","Tokimeki Memorial is a Strategy game, published by Konami,which was released in Japan in 1994.","n/a","5.0","n/a","Konami","May 27, 1994 ","http://www.gamefaqs.com/turbocd/916139-tokimeki-memorial"
"Top o Nerae ! Gun Buster Vol.1","Adventure,General","Top o Nerae ! Gun Buster Vol.1 is an Adventure game, published by River Hill Software,which was released in Japan in 1992.","n/a","n/a","n/a","River Hill Software","Jun 25, 1992 ","http://www.gamefaqs.com/turbocd/916140-top-o-nerae-gun-buster-vol1"
"Top o Nerae ! Gun Buster Vol.2","Adventure,General","Top o Nerae ! Gun Buster Vol.2 is an Adventure game, published by River Hill Software,which was released in Japan in 1993.","n/a","n/a","n/a","River Hill Software","Mar 26, 1993 ","http://www.gamefaqs.com/turbocd/916141-top-o-nerae-gun-buster-vol2"
"Travel Epule","Action,General","Travel Epule is an Action game, published by Nippon Telenet,which was released in Japan in 1992.","n/a","n/a","n/a","Nippon Telenet","Sep4, 1992 ","http://www.gamefaqs.com/turbocd/916143-travel-epule"
"Travellers!","Role-Playing,General","Travellers! is a Role-Playing game, published by Victor Interactive Software,which was released in Japan in 1994.","n/a","n/a","n/a","Victor Interactive Software","Dec 29, 1994 ","http://www.gamefaqs.com/turbocd/916142-travellers"
"Travellers!","Role-Playing,General","Travellers! is a Role-Playing game, published by Victor Interactive Software,which was released in Japan in 1994.","n/a","n/a","n/a","Victor Interactive Software","Dec 29, 1994 ","http://www.gamefaqs.com/turbocd/916142-travellers"
"Turbo CD","Hardware,Console","Turbo CD is a Hardware game, developed by NEC Interchannel and published by Hudson,which was released in Japan in 1988.","9.0","8.5","n/a","NEC Interchannel","1989 ","http://www.gamefaqs.com/turbocd/916397-turbo-cd"
"Turbo CD","Hardware,Console","Turbo CD is a Hardware game, developed by NEC Interchannel and published by Hudson,which was released in Japan in 1988.","9.0","8.5","n/a","NEC Interchannel","1989 ","http://www.gamefaqs.com/turbocd/916397-turbo-cd"
"Turbo CD","Hardware,Console","Turbo CD is a Hardware game, developed by NEC Interchannel and published by Hudson,which was released in Japan in 1988.","9.0","8.5","n/a","NEC Interchannel","1989 ","http://www.gamefaqs.com/turbocd/916397-turbo-cd"
"The TV Show","Action,General","The TV Show is an Action game, published by Right Stuff,which was released in Japan in 1995.","n/a","n/a","n/a","Right Stuff","Sep 29, 1995 ","http://www.gamefaqs.com/turbocd/916144-the-tv-show"
