"Title","Genres","Description","GameFAQs_Reader_Rating","GameFAQs_Rating","MetaCritics_MetaScore","Developer","ReleaseDate","ReferenceURL",
"A.III: A-Ressha de Ikou III","Strategy,Breeding/Constructing","A.III: A-Ressha de Ikou III is a Strategy game, published by Artdink,which was released in Japan in 1993.","n/a","n/a","n/a","Artdink","Jun 11, 1993 ","http://www.gamefaqs.com/turbocd/589184-aiii-a-ressha-de-ikou-iii"
"The Addams Family","Action,Platformer,2D","The Addams Family is an Action game, developed by ICOM Simulations and published by Turbo Technologies, Inc.,which was released in 1991.","3.0","3.7","n/a","ICOM Simulations","1991 ","http://www.gamefaqs.com/turbocd/589185-the-addams-family"
"Advanced V.G.","Action,Fighting,2D","Advanced V.G. is an Action game, developed and published by TGL,which was released in Japan in 1994.","8.0","6.0","","","","http://www.gamefaqs.com/turbocd/589186-advanced-vg"
"Adventure Quiz Capcom World: Hatena no Daibouken","Miscellaneous,Trivia / Game Show","Adventure Quiz Capcom World: Hatena no Daibouken is a Miscellaneous game, developed by Alfa System and published by Hudson,which was released in Japan in 1992.","n/a","n/a","n/a","Alfa System","Jun 19, 1992 ","http://www.gamefaqs.com/turbocd/589188-adventure-quiz-capcom-world-hatena-no-daibouken"
"Ai Cho Aniki","Action,Shooter,Scrolling","Ai Cho Aniki is an Action game, developed by Bits Laboratory and published by NCS,which was released in Japan in 1995.","8.0","7.0","","","","http://www.gamefaqs.com/turbocd/589240-ai-cho-aniki"
"Akiyama Jin No Suugaku Mystery","Miscellaneous,Edutainment","Akiyama Jin No Suugaku Mystery is a Miscellaneous game, developed and published by NHK,which was released in Japan in 1994.","n/a","n/a","n/a","NHK","Dec 10, 1994 ","http://www.gamefaqs.com/turbocd/991430-akiyama-jin-no-suugaku-mystery"
"Akumajou Dracula X: Chi no Rondo","Action,General","Akumajou Dracula X: Chi no Rondo is an Action game, developed and published by Konami,which was released in Japan in 1993.","9.6","9.0","","","","http://www.gamefaqs.com/turbocd/589264-akumajou-dracula-x-chi-no-rondo"
"Alnam no Kiba: Shouzoku Juunishin-to Densetsu","Role-Playing,General","Alnam no Kiba: Shouzoku Juunishin-to Densetsu is a Role-Playing game, published by Right Stuff,which was released in Japan in 1994.","n/a","6.0","n/a","Right Stuff","Dec 22, 1994 ","http://www.gamefaqs.com/turbocd/589196-alnam-no-kiba-shouzoku-juunishin-to-densetsu"
"Alshark","Role-Playing,General","Alshark is a Role-Playing game, developed by Right Stuff and published by Victor Interactive Software,which was released in Japan in 1994.","n/a","10.0","n/a","Right Stuff","Aug 26, 1994 ","http://www.gamefaqs.com/turbocd/589190-alshark"
"Alzadick: Summer Carnival `92","Action,Shooter,Scrolling","Alzadick: Summer Carnival `92 is an Action game, published by Naxat Soft,which was released in Japan in 1992.","6.0","7.5","n/a","Naxat Soft","Jul 17, 1992 ","http://www.gamefaqs.com/turbocd/916111-alzadick-summer-carnival-92"
"Anesan","Action,Beat-'Em-Up","Anesan is an Action game, developed and published by NEC Interchannel,which was released in Japan in 1995.","5.0","6.6","n/a","NEC Interchannel","Feb 24, 1995 ","http://www.gamefaqs.com/turbocd/589192-anesan"
"Aoki Ookami to Shiroki Meshika: Genchou Hishi","Strategy,Breeding/Constructing","Aoki Ookami to Shiroki Meshika: Genchou Hishi is a Strategy game, published by Koei,which was released in Japan in 1993.","n/a","6.0","n/a","Koei","Sep 30, 1993 ","http://www.gamefaqs.com/turbocd/589194-aoki-ookami-to-shiroki-meshika-genchou-hishi"
"Asuka 120% Maxima: Burning Fest. Maxima","Action,Fighting,2D","Asuka 120% Maxima: Burning Fest. Maxima is an Action game, developed by Fill-In Cafe and published by NEC Interchannel,which was released in Japan in 1995.","n/a","7.3","","","","http://www.gamefaqs.com/turbocd/589227-asuka-120-maxima-burning-fest-maxima"
"The Atlas: Renaissance Voyager","Strategy,Breeding/Constructing","The Atlas: Renaissance Voyager is a Strategy game, published by Artdink,which was released in Japan in 1994.","n/a","n/a","n/a","Artdink","Mar4, 1994 ","http://www.gamefaqs.com/turbocd/589198-the-atlas-renaissance-voyager"
"Aurora Quest: Otaku no Seiza in Another World","Role-Playing,General","Aurora Quest: Otaku no Seiza in Another World is a Role-Playing game, published by Pack-In-Video,which was released in Japan in 1993.","n/a","8.0","n/a","Pack-In-Video","Dec 10, 1993 ","http://www.gamefaqs.com/turbocd/589199-aurora-quest-otaku-no-seiza-in-another-world"
"Auto Crusher Palladium","Strategy,Breeding/Constructing","Auto Crusher Palladium is a Strategy game, published by Pack-In-Video,which was released in Japan in 1994.","n/a","n/a","n/a","Pack-In-Video","Feb 25, 1994 ","http://www.gamefaqs.com/turbocd/589200-auto-crusher-palladium"
"AV Tanjou","Strategy,Breeding/Constructing","AV Tanjou is a Strategy game, developed and published by Games Express,which was released in Asia in 1995.","n/a","n/a","n/a","Games Express","Feb 24, 1995 ","http://www.gamefaqs.com/turbocd/701101-av-tanjou"
"Avenger","Action,Shooter,Scrolling","Avenger is an Action game, developed by Nippon Telenet and published by Laser Soft,which was released in Japan in 1990.","n/a","7.0","n/a","Nippon Telenet","Dec7, 1990 ","http://www.gamefaqs.com/turbocd/589202-avenger"
"Babel","Role-Playing,General","Babel is a Role-Playing game, developed by Laser Soft and published by Nippon Telenet,which was released in Japan in 1992.","6.0","10.0","n/a","Laser Soft","Mar 27, 1992 ","http://www.gamefaqs.com/turbocd/589203-babel"
"Baby Jo: The Super Hero","Action,Platformer,2D","Baby Jo: The Super Hero is an Action game, developed by Loriciels and published by Micro World,which was released in Japan in 1992.","n/a","n/a","n/a","Loriciels","Aug 28, 1992 ","http://www.gamefaqs.com/turbocd/589204-baby-jo-the-super-hero"
"Bakuden Unbalance Zone","Adventure,General","Bakuden Unbalance Zone is an Adventure game, published by Sony Music Entertainment Incorporated,which was released in Japan in 1994.","n/a","n/a","n/a","Sony Music Entertainment Incorporated","Apr 22, 1994 ","http://www.gamefaqs.com/turbocd/589205-bakuden-unbalance-zone"
"Bakushou Yoshimoto Shingeki","Action,General","Bakushou Yoshimoto Shingeki is an Action game, developed and published by Hudson,which was released in Japan in 1994.","n/a","6.3","n/a","Hudson","Jan3, 1994 ","http://www.gamefaqs.com/turbocd/589206-bakushou-yoshimoto-shingeki"
"Basted","Role-Playing,Console-style RPG","Basted is a Role-Playing game, published by NEC Avenue,which was released in Japan in 1994.","n/a","6.0","n/a","NEC Avenue","Oct 21, 1994 ","http://www.gamefaqs.com/turbocd/589208-basted"
"Bazaru de Gozaru No Game Degozaru","Miscellaneous,Puzzle,General","Bazaru de Gozaru No Game Degozaru is a Miscellaneous game, developed by Game Freak and published by NEC Interchannel,which was released in Japan in 1996.","n/a","n/a","n/a","Game Freak","Jul 26, 1996 ","http://www.gamefaqs.com/turbocd/589212-bazaru-de-gozaru-no-game-degozaru"
"Beyond Shadowgate","Adventure,General","As the last descendant in the &quot;Line of Kings&quot;, Prince Erik is summoned home to regain his rightful place on his father's throne. But alas, Prince Erik is accused of his father's murder by the evil Royal Advisor Belezaar, and is thrown into the dungeon to be executed at dawn. Your mission and destiny are intertwined. Escape the dungeon and start your long journey toward the land deep within Castle Shadowgate. Your quest is to free the kingdom from the evil grips of the Warlock Lord. You will need to make good use of all the resources you can find throughout your journey. Evil abounds, and creatures great and small will try to defeat you! Use the good that comes of it because the Legend of Shadowgate rests in your hands!","9.0","8.1","n/a","ICOM Simulations","1993 ","http://www.gamefaqs.com/turbocd/589213-beyond-shadowgate"
"Bikkuriman Daijikai","Miscellaneous,General","Bikkuriman Daijikai is a Miscellaneous game, developed and published by Hudson,which was released in Japan in 1988.","n/a","6.0","n/a","Hudson","Dec 23, 1988 ","http://www.gamefaqs.com/turbocd/589215-bikkuriman-daijikai"
"Bishoujo Senshi Sailor Moon","Action,Beat-'Em-Up","Bishoujo Senshi Sailor Moon is an Action game, published by Banpresto,which was released in Japan in 1994.","n/a","7.0","n/a","Banpresto","Aug5, 1994 ","http://www.gamefaqs.com/turbocd/563781-bishoujo-senshi-sailor-moon"
"Bishoujo Senshi Sailor Moon Collection","Miscellaneous,General","Bishoujo Senshi Sailor Moon Collection is a Miscellaneous game, published by Banpresto,which was released in Japan in 1994.","n/a","6.0","n/a","Banpresto","Nov 25, 1994 ","http://www.gamefaqs.com/turbocd/563782-bishoujo-senshi-sailor-moon-collection"
"Black Hole Assault","Action,General","Black Hole Assault is an Action game, published by Micronet,which was released in Japan in 1993.","n/a","n/a","n/a","Micronet","Jul 23, 1993 ","http://www.gamefaqs.com/turbocd/589217-black-hole-assault"
"Blood Gear","Action,General","Blood Gear is an Action game, developed by West One and published by Hudson,which was released in Japan in 1994.","8.5","7.0","n/a","West One","Oct 28, 1994 ","http://www.gamefaqs.com/turbocd/589218-blood-gear"
"Bomberman: Panic Bomber","Miscellaneous,Puzzle,Stacking","Bomberman: Panic Bomber is a Miscellaneous game, published by Hudson,which was released in Japan in 1994.","n/a","6.3","n/a","Hudson","Dec 22, 1994 ","http://www.gamefaqs.com/turbocd/563719-bomberman-panic-bomber"
"Bonanza Bros.","Action,General","Bonanza Bros. is an Action game, published by NEC Interchannel,which was released in Japan in 1992.","n/a","n/a","n/a","NEC Interchannel","Jul 31, 1992 ","http://www.gamefaqs.com/turbocd/589219-bonanza-bros"
"Bonk 3: Bonk's Big Adventure CD","Action,Platformer,2D","Bonk 3: Bonk's Big Adventure CD is an Action game, developed by Hudson and published by Turbo Technologies, Inc.,which was released in 1994.","9.0","8.2","n/a","Hudson","December 1994 ","http://www.gamefaqs.com/turbocd/589220-bonk-3-bonks-big-adventure-cd"
"Brandish","Role-Playing,Action RPG","Brandish is a Role-Playing game, developed and published by NEC Interchannel,which was released in Japan in 1994.","n/a","7.0","n/a","NEC Interchannel","Jun 17, 1994 ","http://www.gamefaqs.com/turbocd/589221-brandish"
"Browning","Action,General","Browning is an Action game, published by Nippon Telenet,which was released in Japan in 1992.","n/a","n/a","n/a","Nippon Telenet","Feb7, 1992 ","http://www.gamefaqs.com/turbocd/589222-browning"
"Builderland","Miscellaneous,Puzzle,General","Builderland is a Miscellaneous game, developed by Loriciels and published by Micro World,which was released in Japan in 1992.","n/a","n/a","n/a","Loriciels","Apr1, 1992 ","http://www.gamefaqs.com/turbocd/589223-builderland"
"Burai II: Yami Koutei no Gyakushuu","Role-Playing,General","Burai II: Yami Koutei no Gyakushuu is a Role-Playing game, published by River Hill Software,which was released in Japan in 1992.","n/a","6.0","n/a","River Hill Software","Dec 18, 1992 ","http://www.gamefaqs.com/turbocd/589225-burai-ii-yami-koutei-no-gyakushuu"
"Burai: Hachigyoku no Yuushi Densetsu","Role-Playing,General","Burai: Hachigyoku no Yuushi Densetsu is a Role-Playing game, published by River Hill Software,which was released in Japan in 1991.","n/a","n/a","n/a","River Hill Software","Aug6, 1991 ","http://www.gamefaqs.com/turbocd/589226-burai-hachigyoku-no-yuushi-densetsu"
"Buster Bros.","Action,Shooter,Scrolling","Buster Bros. is an Action game, developed and published by Hudson,which was released in Japan in 1991.","n/a","7.0","n/a","Hudson","1993 ","http://www.gamefaqs.com/turbocd/589228-buster-bros"
"CAL II","Adventure,General","CAL II is an Adventure game, published by NEC Interchannel,which was released in Japan in 1993.","n/a","n/a","n/a","NEC Interchannel","Mar 31, 1993 ","http://www.gamefaqs.com/turbocd/589229-cal-ii"
"CAL III: Kanketsuhen","Adventure,General","CAL III: Kanketsuhen is an Adventure game, developed and published by NEC Avenue,which was released in Japan in 1994.","n/a","n/a","n/a","NEC Avenue","Mar 25, 1994 ","http://www.gamefaqs.com/turbocd/589230-cal-iii-kanketsuhen"
"Camp California","Action,Platformer,2D","Camp California is an Action game, developed by ICOM Simulations and published by Turbo Technologies, Inc.,which was released in 1993.","n/a","n/a","n/a","ICOM Simulations","1993 ","http://www.gamefaqs.com/turbocd/589231-camp-california"
"Card Angels","Miscellaneous,Board Games","Card Angels is a Miscellaneous game, developed and published by Fujicom,which was released in Japan in 1994.","n/a","6.0","n/a","Fujicom","Dec9, 1994 ","http://www.gamefaqs.com/turbocd/589232-card-angels"
"Where in the World is Carmen Sandiego?","Adventure,General","Where in the World is Carmen Sandiego? is an Adventure game, developed by Office Koukan and published by Pack-In-Video,which was released in Japan in 1990.","n/a","5.0","n/a","Office Koukan","Mar 30, 1990 ","http://www.gamefaqs.com/turbocd/916160-where-in-the-world-is-carmen-sandiego"
"Akumajou Dracula X: Chi no Rondo","Action,General","Akumajou Dracula X: Chi no Rondo is an Action game, developed and published by Konami,which was released in Japan in 1993.","9.6","9.0","","","","http://www.gamefaqs.com/turbocd/589264-akumajou-dracula-x-chi-no-rondo"
"CD Battle Hikari no Yuushatachi","Miscellaneous,General","CD Battle Hikari no Yuushatachi is a Miscellaneous game, published by King Records,which was released in Japan in 1993.","n/a","4.0","n/a","King Records","Mar 19, 1993 ","http://www.gamefaqs.com/turbocd/589233-cd-battle-hikari-no-yuushatachi"
"Super Air Zonk","Action,Shooter,Scrolling","Super Air Zonk is an Action game, developed by Dual and published by Hudson,which was released in Japan in 1993.","n/a","7.4","","","","http://www.gamefaqs.com/turbocd/916112-super-air-zonk"
"CD Hanafuda Bishoujo Fan Club","Miscellaneous,General","CD Hanafuda Bishoujo Fan Club is a Miscellaneous game, developed and published by Games Express,which was released in Japan in 1994.","n/a","n/a","n/a","Games Express","Nov 25, 1994 ","http://www.gamefaqs.com/turbocd/719168-cd-hanafuda-bishoujo-fan-club"
"CD Mahjong Bishoujo Chuushinha","Miscellaneous,Board Games","CD Mahjong Bishoujo Chuushinha is a Miscellaneous game, developed by Bits Laboratory and published by Games Express,which was released in Japan in 1993.","n/a","n/a","n/a","Bits Laboratory","Jul 30, 1993 ","http://www.gamefaqs.com/turbocd/664549-cd-mahjong-bishoujo-chuushinha"
"Championship Rally","Driving,Racing,Arcade","Championship Rally is a Driving game, developed by Fill-In Cafe and published by Intec,which was released in Japan in 1993.","n/a","n/a","n/a","Fill-In Cafe","Aug6, 1993 ","http://www.gamefaqs.com/turbocd/589238-championship-rally"
"Chiki Chiki Boys","Action,Platformer,2D","Chiki Chiki Boys is an Action game, published by NEC Interchannel,which was released in Japan in 1994.","n/a","8.0","n/a","NEC Interchannel","Jul 15, 1994 ","http://www.gamefaqs.com/turbocd/589239-chiki-chiki-boys"
"Cho Aniki","Action,Shooter,Scrolling","Cho Aniki is an Action game, published by NCS,which was released in Japan in 1992.","8.0","7.9","","","","http://www.gamefaqs.com/turbocd/571610-cho-aniki"
"The Dynastic Hero","Role-Playing,Action RPG","The Dynastic Hero is a Role-Playing game, developed by Alfa System and published by Turbo Technologies, Inc.,which was released in 1993.","8.7","8.0","","","","http://www.gamefaqs.com/turbocd/589274-the-dynastic-hero"
"Macross 2036","Action,Shooter,Scrolling","Macross 2036 is an Action game, developed by Dual and published by NCS,which was released in Japan in 1992.","9.0","8.3","n/a","Dual","Apr3, 1992 ","http://www.gamefaqs.com/turbocd/916086-macross-2036"
"Macross: Eien no Love Song","Strategy,Breeding/Constructing","Macross: Eien no Love Song is a Strategy game, published by NCS,which was released in Japan in 1992.","n/a","7.0","n/a","NCS","Dec4, 1992 ","http://www.gamefaqs.com/turbocd/916085-macross-eien-no-love-song"
"Cobra II: Densetsu no Otoko","Adventure,General","Cobra II: Densetsu no Otoko is an Adventure game, developed by Mutech and published by Hudson,which was released in Japan in 1991.","n/a","n/a","n/a","Mutech","Jun7, 1991 ","http://www.gamefaqs.com/turbocd/589242-cobra-ii-densetsu-no-otoko"
"Cobra Kuroryuuou no Densetsu","Adventure,General","Cobra Kuroryuuou no Densetsu is an Adventure game, published by Hudson,which was released in Japan in 1989.","n/a","n/a","n/a","Hudson","Mar4, 1989 ","http://www.gamefaqs.com/turbocd/589241-cobra-kuroryuuou-no-densetsu"
"Color Wars","Miscellaneous,Puzzle,General","Color Wars is a Miscellaneous game, developed by Tomcat System and published by Coconuts Japan,which was released in Japan in 1992.","n/a","n/a","n/a","Tomcat System","Jul 10, 1992 ","http://www.gamefaqs.com/turbocd/589243-color-wars"
"Cosmic Fantasy 2","Role-Playing,Console-style RPG","Turn your imagination over to a Cosmic Fantasy of epic proportions! Laura has been kidnapped, and you must reach her before it's too late. Cut a swath of destruction through the throng of monsters blocking the path to Galam's hideout to save her. Along the way, make friends, solve puzzles, and learn magic while inching your way toward a confrontation that will shake the cosmos! Interactive fantasy role playing takes on a whole new dimension with the addition of animated intermissions that will get you involved in the story! And, what's more, the true RPG-style combat interface will put you right in the action!","6.0","7.2","","","","http://www.gamefaqs.com/turbocd/589246-cosmic-fantasy-2"
"Cosmic Fantasy 2","Role-Playing,Console-style RPG","Turn your imagination over to a Cosmic Fantasy of epic proportions! Laura has been kidnapped, and you must reach her before it's too late. Cut a swath of destruction through the throng of monsters blocking the path to Galam's hideout to save her. Along the way, make friends, solve puzzles, and learn magic while inching your way toward a confrontation that will shake the cosmos! Interactive fantasy role playing takes on a whole new dimension with the addition of animated intermissions that will get you involved in the story! And, what's more, the true RPG-style combat interface will put you right in the action!","6.0","7.2","","","","http://www.gamefaqs.com/turbocd/589246-cosmic-fantasy-2"
"Cosmic Fantasy 3: Bouken Shounen Rei","Role-Playing,General","Cosmic Fantasy 3: Bouken Shounen Rei is a Role-Playing game, developed by Open Sesame and published by Nippon Telenet,which was released in Japan in 1992.","n/a","6.7","n/a","Open Sesame","Sep 25, 1992 ","http://www.gamefaqs.com/turbocd/589247-cosmic-fantasy-3-bouken-shounen-rei"
"Cosmic Fantasy 4: Ginga Shounen Densetsu (Gekitouhen)","Role-Playing,General","Cosmic Fantasy 4: Ginga Shounen Densetsu (Gekitouhen) is a Role-Playing game, developed by Open Sesame and published by Nippon Telenet,which was released in Japan in 1994.","n/a","7.0","n/a","Open Sesame","Nov 25, 1994 ","http://www.gamefaqs.com/turbocd/589248-cosmic-fantasy-4-ginga-shounen-densetsu-gekitouhen"
"Cosmic Fantasy 4: Ginga Shounen Densetsu (Totsunyuuhen)","Role-Playing,General","Cosmic Fantasy 4: Ginga Shounen Densetsu (Totsunyuuhen) is a Role-Playing game, developed by Open Sesame and published by Nippon Telenet,which was released in Japan in 1994.","n/a","7.0","n/a","Open Sesame","Jun 10, 1994 ","http://www.gamefaqs.com/turbocd/589249-cosmic-fantasy-4-ginga-shounen-densetsu"
"Cosmic Fantasy Visual Shuu","Miscellaneous,General","Cosmic Fantasy Visual Shuu is a Miscellaneous game, published by Nippon Telenet,which was released in Japan in 1993.","n/a","1.0","n/a","Nippon Telenet","Feb 12, 1993 ","http://www.gamefaqs.com/turbocd/589250-cosmic-fantasy-visual-shuu"
"Cosmic Fantasy: Bouken Shounen Yuu","Role-Playing,General","Cosmic Fantasy: Bouken Shounen Yuu is a Role-Playing game, published by Nippon Telenet,which was released in Japan in 1990.","6.0","7.0","n/a","Nippon Telenet","Mar 30, 1990 ","http://www.gamefaqs.com/turbocd/589245-cosmic-fantasy-bouken-shounen-yuu"
"Cotton: Fantastic Night Dreams","Action,Shooter,Scrolling","Cotton: Fantastic Night Dreams is an Action game, developed and published by Hudson,which was released in Japan in 1993.","n/a","8.3","","","","http://www.gamefaqs.com/turbocd/589251-cotton-fantastic-night-dreams"
"Riot Zone","Action,Beat-'Em-Up","Riot Zone is a side-scrolling fighting game that follows two heroes as they fight to take down an evil organization. The crime syndicate Dragon Zone has kidnapped Hawk's girlfriend and it's up to him and his partner detective, Tony, to get her back. Join them as they jump &quot;fists first&quot; into the grim Kowloon district.","4.5","5.8","","","","http://www.gamefaqs.com/turbocd/563763-riot-zone"
"Cyber City Oedo 808","Adventure,General","Cyber City Oedo 808 is an Adventure game, developed by Dual and published by NCS,which was released in Japan in 1991.","n/a","n/a","n/a","Dual","Mar 15, 1991 ","http://www.gamefaqs.com/turbocd/589253-cyber-city-oedo-808"
"Daisenpuu Custom","Action,Shooter,Scrolling","Daisenpuu Custom is an Action game, published by NEC Interchannel,which was released in Japan in 1991.","n/a","n/a","n/a","NEC Interchannel","Jul 26, 1991 ","http://www.gamefaqs.com/turbocd/916045-daisenpuu-custom"
"Daisenryaku II Campaign-Han","Strategy,Breeding/Constructing","Daisenryaku II Campaign-Han is a Strategy game, published by Micro Cabin,which was released in Japan in 1992.","n/a","8.0","n/a","Micro Cabin","May 29, 1992 ","http://www.gamefaqs.com/turbocd/571608-daisenryaku-ii-campaign-han"
"The Davis Cup Tennis","Sports,Traditional,Tennis","The Davis Cup Tennis is a Sports game, developed by Loriciels and published by Micro World,which was released in Japan in 1992.","n/a","n/a","n/a","Loriciels","Apr1, 1992 ","http://www.gamefaqs.com/turbocd/589254-the-davis-cup-tennis"
"De-Ja","Adventure,General","De-Ja is an Adventure game, developed by Elf and published by NEC Interchannel,which was released in Japan in 1996.","n/a","n/a","n/a","Elf","Jul 12, 1996 ","http://www.gamefaqs.com/turbocd/589255-de-ja"
"Dead of the Brain 1 & 2","Adventure,General","Dead of the Brain 1 & 2 is an Adventure game, developed by Fairy Tale and published by NEC Interchannel,which was released in Japan in 1999.","n/a","n/a","n/a","Fairy Tale","Jun3, 1999 ","http://www.gamefaqs.com/turbocd/571615-dead-of-the-brain-1-and-2"
"Death Bringer","Role-Playing,General","Death Bringer is a Role-Playing game, published by Nippon Telenet,which was released in Japan in 1990.","n/a","n/a","n/a","Nippon Telenet","Apr 27, 1990 ","http://www.gamefaqs.com/turbocd/589256-death-bringer"
"Death Bringer","Role-Playing,General","Death Bringer is a Role-Playing game, published by Nippon Telenet,which was released in Japan in 1990.","n/a","n/a","n/a","Nippon Telenet","Apr 27, 1990 ","http://www.gamefaqs.com/turbocd/589256-death-bringer"
"Dekoboko Densetsu: Hashiru Wagamanma","Driving,Racing,Arcade","Dekoboko Densetsu: Hashiru Wagamanma is a Driving game, published by Nippon Telenet,which was released in Japan in 1990.","n/a","n/a","n/a","Nippon Telenet","Nov2, 1990 ","http://www.gamefaqs.com/turbocd/579863-dekoboko-densetsu-hashiru-wagamanma"
"Denno Tenshi: Digital Angel","Adventure,General","Denno Tenshi: Digital Angel is an Adventure game, published by Tokuma Shoten,which was released in Japan in 1994.","n/a","9.5","n/a","Tokuma Shoten","Nov 16, 1994 ","http://www.gamefaqs.com/turbocd/589257-denno-tenshi-digital-angel"
"Digital Comic - Patlabor: Chapter of Griffon","Adventure,General","Digital Comic - Patlabor: Chapter of Griffon is an Adventure game, published by River Hill Software,which was released in Japan in 1993.","n/a","n/a","n/a","River Hill Software","Sep 30, 1993 ","http://www.gamefaqs.com/turbocd/916063-digital-comic-patlabor-chapter-of-griffon"
"Doraemon Nobita No Dorabian Nights","Action,Platformer,2D","Doraemon Nobita No Dorabian Nights is an Action game, developed by Now Production and published by Hudson,which was released in Japan in 1992.","n/a","10.0","n/a","Now Production","May 29, 1992 ","http://www.gamefaqs.com/turbocd/571607-doraemon-nobita-no-dorabian-nights"
"Doraemon Nobita No Dorabian Nights","Action,Platformer,2D","Doraemon Nobita No Dorabian Nights is an Action game, developed by Now Production and published by Hudson,which was released in Japan in 1992.","n/a","10.0","n/a","Now Production","May 29, 1992 ","http://www.gamefaqs.com/turbocd/571607-doraemon-nobita-no-dorabian-nights"
"Double Dragon II: The Revenge","Action,Beat-'Em-Up","The Double Dragons - Billy and Jimmy Lee - are back to avenge the loss of Marion! In their quest to defeat the evil Shadow Warriors, the martial arts duo are challenged in 9 incredible missions, facing ruthless street gangs, nunchaku-toting ninja and giant mutant warriors! The non-stop action winds its way through construction sites, alleyways and underwater hideouts complete with secret elevator shafts, spiked ceilings and razor-sharp mechanical claws!","8.0","6.0","n/a","Kid","Mar 12, 1993 ","http://www.gamefaqs.com/turbocd/589259-double-dragon-ii-the-revenge"
"Doukyuusei","Miscellaneous,Virtual Life","Doukyuusei is a Miscellaneous game, developed by Flight-Plan and published by NEC Interchannel,which was released in Japan in 1995.","n/a","n/a","n/a","Flight-Plan","Nov 23, 1995 ","http://www.gamefaqs.com/turbocd/589258-doukyuusei"
"Download 2","Action,Shooter,Scrolling","Download 2 is an Action game, published by NEC Interchannel,which was released in Japan in 1991.","n/a","7.3","","","","http://www.gamefaqs.com/turbocd/589261-download-2"
