"Title","Genres","Description","GameFAQs_Reader_Rating","GameFAQs_Rating","MetaCritics_MetaScore","Developer","ReleaseDate","ReferenceURL",
"Kensington","Miscellaneous,Board Games","Kensington is a Miscellaneous game, developed and published by Leisure Genius,which was released in Europe in 1984.","n/a","n/a","n/a","Leisure Genius","1984 ","http://www.gamefaqs.com/bbc/950705-kensington"
"Killapede","Action,Shooter,Static","The KILLAPEDE and a whole gang of creepy-crawlies are out to get you! Dodge the fleas and the spiders from Mars to shoot at this multi-segmented beast. You must be quick though, as a fate of almost certain death awaits you!","n/a","5.0","n/a","Players","1986 ","http://www.gamefaqs.com/bbc/950704-killapede"
"Killer Gorilla","Action,General","Killer Gorilla is an Action game, developed and published by Micro Power,which was released in Europe in 1984.","n/a","6.5","n/a","Micro Power","1984 ","http://www.gamefaqs.com/bbc/949691-killer-gorilla"
"Killer Gorilla 2","Action,Platformer,2D","Killer Gorilla 2 is an Action game, developed and published by Superior Software,which was released in Europe in 1988.","n/a","7.0","n/a","Superior Software","1988 ","http://www.gamefaqs.com/bbc/949492-killer-gorilla-2"
"Kingdom Of Hamil","Adventure,Text","Kingdom Of Hamil is an Adventure game, developed and published by Acornsoft,which was released in Europe in 1983.","n/a","n/a","n/a","Acornsoft","1983 ","http://www.gamefaqs.com/bbc/949307-kingdom-of-hamil"
"The Kingdom Of Klein","Adventure,Text","The Kingdom Of Klein is an Adventure game, developed and published by Epic,which was released in Europe in 1984.","n/a","n/a","n/a","Epic","1984 ","http://www.gamefaqs.com/bbc/950663-the-kingdom-of-klein"
"Kissin' Kousins","Action,General","Kissin' Kousins is an Action game, developed and published by English Software,which was released in Europe in 1985.","n/a","n/a","n/a","English Software","1985 ","http://www.gamefaqs.com/bbc/950526-kissin-kousins"
"Kix","Action,General","Kix is an Action game, developed and published by Superior Software,which was released in Europe in 1986.","n/a","n/a","n/a","Superior Software","1986 ","http://www.gamefaqs.com/bbc/949493-kix"
"Klax","Miscellaneous,Puzzle,Matching","KLAX - It's simple in concept and easy to play. Catch the colored tiles with the paddle and flip them into bins to make same colored stacks, diagonals and rows of three. Sounds easy? It is. The hard part is pulling yourself away from this fun and addictive game!","n/a","n/a","n/a","Atari","1990 ","http://www.gamefaqs.com/bbc/950527-klax"
"Knight Lore","Action,General","Knight Lore is an Action game, developed and published by Ultimate Play The Game,which was released in Europe in 1984.","n/a","7.5","n/a","Ultimate Play The Game","1984 ","http://www.gamefaqs.com/bbc/950468-knight-lore"
"Knight Orc","Adventure,Text","Set in three parts, Knight Orc casts you as an oppressed orc in a magical world where all is not as it first seems. For generations, humans have been persecuting orcs, and now it's time to get your own back. Knight Orc is a challenging game which is truly interactive. Each character leads its own life in the game, and their actions can affect you and the outcome of the adventure. Communication with other characters, learning spells and solving puzzles are all a vital part of the game if you are to escape the mystical world and take revenge on humankind.","n/a","n/a","n/a","Level 9 Computing","1986 ","http://www.gamefaqs.com/bbc/950706-knight-orc"
"Kourtyard","Action,General","Kourtyard is an Action game, developed and published by Godax,which was released in Europe in 1988.","n/a","n/a","n/a","Godax","1988 ","http://www.gamefaqs.com/bbc/950660-kourtyard"
"Krakout","Action,General","Krakout is an Action game, developed and published by Gremlin Interactive,which was released in Europe in 1987.","n/a","n/a","n/a","Gremlin Interactive","1987 ","http://www.gamefaqs.com/bbc/950255-krakout"
"Kremlin","Miscellaneous,Puzzle,General","Kremlin is a Miscellaneous game, developed and published by Doctorsoft,which was released in Europe in 1983.","n/a","n/a","n/a","Doctorsoft","1983 ","http://www.gamefaqs.com/bbc/950528-kremlin"
"Kryptogram","Miscellaneous,Puzzle,General","Kryptogram is a Miscellaneous game, developed and published by IJK,which was released in Europe in 1982.","n/a","n/a","n/a","IJK","1982 ","http://www.gamefaqs.com/bbc/950256-kryptogram"
"Labyrinth","Action,Shooter,Static","Labyrinth is an Action game, developed and published by Acornsoft,which was released in Europe in 1984.","n/a","7.0","n/a","Acornsoft","1984 ","http://www.gamefaqs.com/bbc/949308-labyrinth"
"Labyrinths Of LaCoshe","Adventure,Text","Labyrinths Of LaCoshe is an Adventure game, developed and published by Micro Power,which was released in Europe in 1983.","n/a","n/a","n/a","Micro Power","1983 ","http://www.gamefaqs.com/bbc/949692-labyrinths-of-lacoshe"
"Ladder Maze","Miscellaneous,Puzzle,General","Ladder Maze is a Miscellaneous game, developed and published by Superior Software,which was released in Europe in 1983.","n/a","n/a","n/a","Superior Software","1983 ","http://www.gamefaqs.com/bbc/949494-ladder-maze"
"Lancelot","Adventure,Text","Travel back to the Age of Chivalry when knights were bold, galloping across the countryside and rescuing damsels in distress. Level 9 recreate the time of wizards and the Knights of the Round Table in their greatest adventure yet. Lancelot is a 3-part adventure, spanning the complete saga from the foundation of the Order to its finest hour - the quest for the Holy Grail. Guide Lancelot through his many exploits at Camelot, battle with wayward knights, and win the love of Guinever and Elaine. The challenge which has fascinated treasure hunters through the centuries is now yours - and you'll need all your strength, wit and valor to achieve your goal.","n/a","n/a","n/a","Level 9 Computing","1988 ","http://www.gamefaqs.com/bbc/949976-lancelot"
"Landfall","Action,General","Landfall is an Action game, developed and published by Virgin Games,which was released in Europe in 1983.","n/a","n/a","n/a","Virgin Games","1983 ","http://www.gamefaqs.com/bbc/950469-landfall"
"Las Vegas","Miscellaneous,Parlor,Gambling","Las Vegas is a Miscellaneous game, developed and published by RH Soft,which was released in Europe in 1983.","n/a","n/a","n/a","RH Soft","1983 ","http://www.gamefaqs.com/bbc/950746-las-vegas"
"Laser Command","Action,Shooter,Static","Laser Command is an Action game, developed and published by Micro Power,which was released in Europe in 1982.","n/a","n/a","n/a","Micro Power","1982 ","http://www.gamefaqs.com/bbc/949693-laser-command"
"Last Ninja 2","Action,Beat-'Em-Up","Last Ninja 2 is an Action game, developed and published by Superior Software,which was released in Europe in 1988.","n/a","7.0","n/a","Superior Software","1988 ","http://www.gamefaqs.com/bbc/949535-last-ninja-2"
"The Last Ninja","Action,General","The Last Ninja is an Action game, developed and published by Superior Software,which was released in Europe in 1988.","n/a","8.0","n/a","Superior Software","1988 ","http://www.gamefaqs.com/bbc/949534-the-last-ninja"
"Last of the Free","Action,Platformer,2D","Last of the Free is an Action game, developed and published by Audiogenic Ltd.,which was released in Europe in 1986.","n/a","6.0","n/a","Audiogenic Ltd.","1986 ","http://www.gamefaqs.com/bbc/950069-last-of-the-free"
"League Challenge","Sports,Traditional,Soccer,Management","League Challenge is a Sports game, developed and published by Atlantis Software,which was released in Europe in 1986.","n/a","n/a","n/a","Atlantis Software","1986 ","http://www.gamefaqs.com/bbc/950529-league-challenge"
"Ledge Man","Action,Platformer,2D","Ledge Man is an Action game, developed and published by Software Projects Ltd.,which was released in Europe in 1984.","n/a","n/a","n/a","Software Projects Ltd.","1984 ","http://www.gamefaqs.com/bbc/950428-ledge-man"
"Legion Adventure","Adventure,Text","Legion Adventure is an Adventure game, developed and published by Software Projects Ltd.,which was released in Europe in 1983.","n/a","n/a","n/a","Software Projects Ltd.","1983 ","http://www.gamefaqs.com/bbc/950429-legion-adventure"
"Lemming Syndrome","Action,General","Lemming Syndrome is an Action game, developed and published by Dynabyte,which was released in Europe in 1983.","n/a","n/a","n/a","Dynabyte","1983 ","http://www.gamefaqs.com/bbc/950530-lemming-syndrome"
"Liberator","Action,Shooter,First-Person,Sci-Fi","Liberator is an Action game, developed and published by Gemini,which was released in Europe in 1983.","n/a","6.0","n/a","Gemini","1983 ","http://www.gamefaqs.com/bbc/950531-liberator"
"Licence to Kill","Action,General","License to Kill is a multi-level, multi-role game - you take the controls of helicopters, boats and tankers, perform some death-defying parachute stunts and take to the seas for a spot of barefoot waterskiing. A steady aim and steady fire is needed - shoot from the hip and take out the &quot;baddies.&quot; It's action-packed and closely follows the latest adventures of the world's best kept Secret Agent in the brand new and most exciting movie of them all. James Bond in License to Kill... appearing now on a small screen near you!","n/a","n/a","n/a","Domark","1989 ","http://www.gamefaqs.com/bbc/950532-licence-to-kill"
"The Life of Repton","Miscellaneous,Puzzle,General","The Life of Repton is a Miscellaneous game, developed and published by Superior Software,which was released in Europe in 1987.","n/a","9.0","n/a","Superior Software","1987 ","http://www.gamefaqs.com/bbc/949536-the-life-of-repton"
"Light Cycles","Action,General","Light Cycles is an Action game, developed and published by Paean,which was released in Europe in 1983.","n/a","n/a","n/a","Paean","1983 ","http://www.gamefaqs.com/bbc/950747-light-cycles"
"The Living Daylights","Action,General","This game is closely based on the all-action film and coin-op arcade game from Arcadia, but puts you into the action as you control James Bond through eight fast and furious levels. Moving from Gibraltar to Afghanistan, you encounter the SAS (friendly), the KGB (not so friendly), enemy helicopters (very unfriendly!) and even a milkman with exploding bottles! Now go ahead and join James Bond - living on the edge!","n/a","n/a","n/a","Domark","1987 ","http://www.gamefaqs.com/bbc/950557-the-living-daylights"
"Locomotion","Simulation,Train","You are the driver of the only train able to supply the townsfolk of the Badlands and thus save them from the marauding bandits. But be warned, the forces of evil are out to stop you from reaching your destination at all costs!","n/a","n/a","n/a","Amazon Systems","1985 ","http://www.gamefaqs.com/bbc/950070-locomotion"
"Lode Runner","Action,General","You're a highly trained Galactic Commando, deep in enemy territory. Your mission: to recover a fortune in gold, stolen from the Bungeling people by their power-hungry leaders. You'll be running, jumping, and climbing heroically, solving perplexing puzzles. With your laser pistol, you'll drill passageways through stone floors and barriers. To get through this mission alive, you'll need more than fleet feet and good looks. You'll need your quick wits and brains. And more than just a little luck.","n/a","n/a","n/a","Software Projects Ltd.","1985 ","http://www.gamefaqs.com/bbc/950438-lode-runner"
"Looney Lift","Action,General","Looney Lift is an Action game, developed and published by H&H Software,which was released in Europe in 1983.","n/a","n/a","n/a","H&H Software","1983 ","http://www.gamefaqs.com/bbc/950707-looney-lift"
"Loopz","Miscellaneous,Puzzle,General","It couldn't be simpler. You get pieces of different sizes and shapes. One by one you put them down on the playing board - soon you've made your first loop. Yeaaaah! Now it's not so easy. This time you didn't get the pieces you wanted. Never mind - just start another loop. All of a sudden the board's getting just a little too crowded. Now you're struggling to find a place to drop the pieces (who cares where they go, you can't afford to let the timer run down because you'll lose a life). Now it's getting really hectic. Did you honestly think this game was simple (and this is just the first level of Game A). Pretty soon you'll be dreaming about LOOPZ. Wondering if next time you'll be able to make a longer loop than ever before - or more loops than your record. Will LOOPZ drive you crazy? You bet!","n/a","n/a","n/a","Audiogenic Ltd.","1990 ","http://www.gamefaqs.com/bbc/950071-loopz"
"The Lord Of The Rings","Adventure,Text","The Lord Of The Rings is an Adventure game, developed and published by Melbourne House,which was released in Europe in 1986.","n/a","n/a","n/a","Melbourne House","1986 ","http://www.gamefaqs.com/bbc/950708-the-lord-of-the-rings"
"Lords Of Time","Adventure,Text","Lords Of Time is an Adventure game, developed and published by Level 9 Computing,which was released in Europe in 1983.","n/a","n/a","n/a","Level 9 Computing","1983 ","http://www.gamefaqs.com/bbc/949975-lords-of-time"
"Lost City","Adventure,Text","Lost City is an Adventure game, developed and published by Superior Software,which was released in Europe in 1983.","n/a","n/a","n/a","Superior Software","1983 ","http://www.gamefaqs.com/bbc/949495-lost-city"
"Lunar Jetman","Action,Shooter,Scrolling","Lunar Jetman is an Action game, developed and published by Ultimate Play The Game,which was released in Europe in 1983.","n/a","n/a","n/a","Ultimate Play The Game","1983 ","http://www.gamefaqs.com/bbc/950470-lunar-jetman"
"Lunar Rescue","Action,Shooter,Static","Lunar Rescue is an Action game, developed by Taito Corporation and published by Alligata Software,which was released in Europe in 1983.","n/a","n/a","n/a","Taito Corporation","1983 ","http://www.gamefaqs.com/bbc/949977-lunar-rescue"
"Magic Adventure","Adventure,Text","Magic Adventure is an Adventure game, developed and published by Kansas City,which was released in Europe in 1983.","n/a","n/a","n/a","Kansas City","1983 ","http://www.gamefaqs.com/bbc/950311-magic-adventure"
"Magic Mushrooms","Action,Platformer,2D","Magic Mushrooms is an Action game, developed and published by Acornsoft,which was released in Europe in 1985.","n/a","n/a","n/a","Acornsoft","1985 ","http://www.gamefaqs.com/bbc/949309-magic-mushrooms"
"Main-Line","Action,General","Main-Line is an Action game, developed and published by CSL Microdata,which was released in Europe in 1982.","n/a","n/a","n/a","CSL Microdata","1982 ","http://www.gamefaqs.com/bbc/950170-main-line"
"Mango","Action,General","Mango is an Action game, developed and published by Blue Ribbon,which was released in Europe in 1987.","n/a","n/a","n/a","Blue Ribbon","1987 ","http://www.gamefaqs.com/bbc/950144-mango"
"Manic Miner","Action,Platformer,2D","Manic Miner is an Action game, developed and published by Software Projects Ltd.,which was released in Europe in 1984.","n/a","7.0","n/a","Software Projects Ltd.","1984 ","http://www.gamefaqs.com/bbc/950430-manic-miner"
"Martian Attack","Action,Shooter,Static","Martian Attack is an Action game, developed and published by Micro Power,which was released in Europe in 1983.","n/a","n/a","n/a","Micro Power","1983 ","http://www.gamefaqs.com/bbc/949694-martian-attack"
"Master Cutler","Simulation,Train","Master Cutler is a Simulation game, developed and published by Dee-Kay Systems,which was released in Europe in 1984.","n/a","n/a","n/a","Dee-Kay Systems","1984 ","http://www.gamefaqs.com/bbc/950257-master-cutler"
"Masters of the Universe: Super Adventure","Adventure,Text","Masters of the Universe: Super Adventure is an Adventure game, developed by Adventuresoft UK Ltd and published by U.S. Gold,which was released in Europe in 1987.","n/a","n/a","n/a","Adventuresoft UK Ltd","1987 ","http://www.gamefaqs.com/bbc/735988-masters-of-the-universe-super-adventure"
"Match Day","Sports,Traditional,Soccer,Arcade","MATCH DAY is no ordinary soccer game. Blistering 3D action and cool animation bring the thrills and spills of football to life on your home computer system! You will marvel at the depth of play and ball control developing your skills and techniques playing against the computer or in knock-out competition. MATCH DAY... shoot to win!","n/a","n/a","n/a","Ocean","1984 ","http://www.gamefaqs.com/bbc/947065-match-day"
"Maze","Miscellaneous,Puzzle,General","Maze is a Miscellaneous game, developed and published by Acornsoft,which was released in Europe in 1984.","n/a","n/a","n/a","Acornsoft","1984 ","http://www.gamefaqs.com/bbc/949310-maze"
"A Maze In Space","Action,Shooter,Scrolling","A Maze In Space is an Action game, developed and published by Opus Software,which was released in Europe in 1983.","n/a","n/a","n/a","Opus Software","1983 ","http://www.gamefaqs.com/bbc/950674-a-maze-in-space"
"Mega Rok","Action,Shooter,Static","Mega Rok is an Action game, developed and published by Bug-Byte,which was released in Europe in 1987.","n/a","n/a","n/a","Bug-Byte","1987 ","http://www.gamefaqs.com/bbc/949978-mega-rok"
"Meteor Mission","Action,Shooter,Static","Meteor Mission is an Action game, developed and published by Acornsoft,which was released in Europe in 1983.","n/a","n/a","n/a","Acornsoft","1983 ","http://www.gamefaqs.com/bbc/949311-meteor-mission"
"Meteors","Action,Shooter,Static","Meteors is an Action game, developed and published by Acornsoft,which was released in Europe in 1982.","n/a","7.0","n/a","Acornsoft","1982 ","http://www.gamefaqs.com/bbc/949312-meteors"
"Mexico '86","Sports,Traditional,Soccer,Sim","Mexico '86 is a Sports game, developed and published by Qualsoft,which was released in Europe in 1986.","n/a","n/a","n/a","Qualsoft","1986 ","http://www.gamefaqs.com/bbc/950405-mexico-86"
"Micro Olympics","Sports,Olympic Sports","Micro Olympics is a Sports game, developed and published by Database Software,which was released in Europe in 1984.","n/a","n/a","n/a","Database Software","1984 ","http://www.gamefaqs.com/bbc/950147-micro-olympics"
"Micro Quest","Miscellaneous,Puzzle,General","Micro Quest is a Miscellaneous game, developed and published by Glengary,which was released in Europe in 1983.","n/a","n/a","n/a","Glengary","1983 ","http://www.gamefaqs.com/bbc/950319-micro-quest"
"Microbe","Action,Shooter,Static","Microbe is an Action game, developed and published by Virgin Games,which was released in Europe in 1983.","n/a","n/a","n/a","Virgin Games","1983 ","http://www.gamefaqs.com/bbc/950471-microbe"
"Microcosm","Action,Platformer,2D","Microcosm is an Action game, developed and published by Firebird,which was released in Europe in 1984.","n/a","5.0","n/a","Firebird","1984 ","http://www.gamefaqs.com/bbc/950258-microcosm"
"Micropower Magic 1","Miscellaneous,Compilation","Micropower Magic 1 is a Miscellaneous game, developed and published by Micro Power,which was released in Europe in 1986.","n/a","n/a","n/a","Micro Power","1986 ","http://www.gamefaqs.com/bbc/949695-micropower-magic-1"
"Micropower Magic 2","Miscellaneous,Compilation","Micropower Magic 2 is a Miscellaneous game, developed and published by Micro Power,which was released in Europe in 1986.","n/a","n/a","n/a","Micro Power","1986 ","http://www.gamefaqs.com/bbc/949696-micropower-magic-2"
"Mikie","Action,General","Mikie is an Action game, developed by Konami and published by Imagine,which was released in Europe in 1986.","n/a","n/a","n/a","Konami","1986 ","http://www.gamefaqs.com/bbc/950259-mikie"
"Millionaire","Strategy,Tycoon","Millionaire is a Strategy game, developed and published by Incentive Software,which was released in Europe in 1984.","n/a","n/a","n/a","Incentive Software","1984 ","http://www.gamefaqs.com/bbc/950260-millionaire"
"Mine","Action,General","Mine is an Action game, developed and published by Micro Power,which was released in Europe in 1984.","n/a","n/a","n/a","Micro Power","1984 ","http://www.gamefaqs.com/bbc/949697-mine"
"The Mine","Action,Platformer,2D","The Mine is an Action game, developed and published by Program Power,which was released in Europe in 1983.","n/a","n/a","n/a","Program Power","1983 ","http://www.gamefaqs.com/bbc/724562-the-mine"
"Mined Out","Strategy,General","Mined Out is a Strategy game, developed and published by Quicksilva,which was released in Europe in 1983.","n/a","n/a","n/a","Quicksilva","1983 ","http://www.gamefaqs.com/bbc/950709-mined-out"
"Mineshaft","Action,General","Mineshaft is an Action game, developed and published by Martech,which was released in Europe in 1984.","n/a","7.0","n/a","Martech","1984 ","http://www.gamefaqs.com/bbc/950261-mineshaft"
"Missile Attack","Action,Shooter,Scrolling","Missile Attack is an Action game, developed and published by Doctorsoft,which was released in Europe in 1983.","n/a","n/a","n/a","Doctorsoft","1983 ","http://www.gamefaqs.com/bbc/950262-missile-attack"
"Missile Base","Action,Shooter,Static","Missile Base is an Action game, developed and published by Acornsoft,which was released in Europe in 1982.","n/a","5.0","n/a","Acornsoft","1982 ","http://www.gamefaqs.com/bbc/949313-missile-base"
"Missile Control","Action,Shooter,Static","Missile Control is an Action game, developed and published by Gemini,which was released in Europe in 1983.","n/a","n/a","n/a","Gemini","1983 ","http://www.gamefaqs.com/bbc/950263-missile-control"
"Missile Strike","Action,Shooter,Static","Missile Strike is an Action game, developed and published by Superior Software,which was released in Europe in 1984.","n/a","n/a","n/a","Superior Software","1984 ","http://www.gamefaqs.com/bbc/949496-missile-strike"
"Model A Invaders","Action,Shooter,Static","Model A Invaders is an Action game, developed and published by IJK,which was released in Europe in 1982.","n/a","n/a","n/a","IJK","1982 ","http://www.gamefaqs.com/bbc/951119-model-a-invaders"
"Monaco","Driving,Racing,Formula One","Monaco is a Driving game, developed and published by Alligata Software,which was released in Europe in 1983.","n/a","n/a","n/a","Alligata Software","1983 ","http://www.gamefaqs.com/bbc/949979-monaco"
"Monkey Nuts","Action,Platformer,2D","Monkey Nuts is an Action game, developed and published by Bug-Byte,which was released in Europe in 1988.","n/a","10.0","n/a","Bug-Byte","1988 ","http://www.gamefaqs.com/bbc/949980-monkey-nuts"
"Monopoly","Miscellaneous,Board Games","Rich Uncle Pennybags is your animated Master of Ceremonies as Depression-era Atlantic City comes to life - from the rolling lawns of Park Place to the lowly backyards of Baltic Avenue! Perform all the wheeling and dealing feats that have made the MONOPOLY game the most popular in the world.","n/a","n/a","n/a","Leisure Genius","1985 ","http://www.gamefaqs.com/bbc/950264-monopoly"
"Monsters","Action,General","Monsters is an Action game, developed and published by Acornsoft,which was released in Europe in 1982.","n/a","7.0","n/a","Acornsoft","1982 ","http://www.gamefaqs.com/bbc/949314-monsters"
"Moon Buggy","Action,Shooter,Scrolling","Moon Buggy is an Action game, developed and published by Kansas City,which was released in Europe in 1985.","n/a","n/a","n/a","Kansas City","1985 ","http://www.gamefaqs.com/bbc/950710-moon-buggy"
"Moon Mission","Action,Shooter,Static","Moon Mission is an Action game, developed and published by Superior Software,which was released in Europe in 1984.","n/a","n/a","n/a","Superior Software","1984 ","http://www.gamefaqs.com/bbc/949698-moon-mission"
"Moon Raider","Action,Shooter,Scrolling","Moon Raider is an Action game, developed and published by Micro Power,which was released in Europe in 1983.","n/a","n/a","n/a","Micro Power","1983 ","http://www.gamefaqs.com/bbc/949699-moon-raider"
"Mr EE!","Action,General","Mr EE! is an Action game, developed and published by Micro Power,which was released in Europe in 1984.","n/a","n/a","n/a","Micro Power","1984 ","http://www.gamefaqs.com/bbc/947266-mr-ee"
"Mr Freeze","Action,Platformer,2D","Mr Freeze is an Action game, developed and published by Firebird,which was released in Europe in 1984.","n/a","n/a","n/a","Firebird","1984 ","http://www.gamefaqs.com/bbc/950265-mr-freeze"
"Mr Mephisto","Action,General","Mr Mephisto is an Action game, developed and published by Euro-Byte,which was released in Europe in 1986.","n/a","n/a","n/a","Euro-Byte","1986 ","http://www.gamefaqs.com/bbc/950533-mr-mephisto"
"Mr Wiz","Action,General","Mr Wiz is an Action game, developed and published by Superior Software,which was released in Europe in 1984.","n/a","n/a","n/a","Superior Software","1984 ","http://www.gamefaqs.com/bbc/949497-mr-wiz"
"Munchyman","Action,General","Munchyman is an Action game, developed and published by Micro Power,which was released in Europe in 1981.","n/a","n/a","n/a","Micro Power","1981 ","http://www.gamefaqs.com/bbc/949700-munchyman"
"Mutant","Action,Shooter,Static","Mutant is an Action game, developed and published by Icon Software,which was released in Europe in 1982.","n/a","n/a","n/a","Icon Software","1982 ","http://www.gamefaqs.com/bbc/950711-mutant"
"Mutant Spiders","Action,Shooter,Static","Mutant Spiders is an Action game, developed and published by Superior Software,which was released in Europe in 1984.","n/a","n/a","n/a","Superior Software","1984 ","http://www.gamefaqs.com/bbc/949498-mutant-spiders"
"Mysterious Adventure 10: Ten Little Indians","Adventure,Text","Mysterious Adventure 10: Ten Little Indians is an Adventure game, developed by Digital Fantasia and published by Adventuresoft UK Ltd,which was released in Europe in 1983.","n/a","n/a","n/a","Digital Fantasia","1983 ","http://www.gamefaqs.com/bbc/950836-mysterious-adventure-10-ten-little-indians"
"Mysterious Adventure 11: Wax Works","Adventure,Text","Mysterious Adventure 11: Wax Works is an Adventure game, developed by Digital Fantasia and published by Adventuresoft UK Ltd,which was released in Europe in 1983.","n/a","n/a","n/a","Digital Fantasia","1983 ","http://www.gamefaqs.com/bbc/950837-mysterious-adventure-11-wax-works"
