"Title","Genres","Description","GameFAQs_Reader_Rating","GameFAQs_Rating","MetaCritics_MetaScore","Developer","ReleaseDate","ReferenceURL",
"Aabatron","Action,Shooter,Static","Aabatron is an Action game, developed and published by Clemoes,which was released in Europe in 1984.","n/a","n/a","n/a","Clemoes","1984 ","http://www.gamefaqs.com/bbc/950658-aabatron"
"Abyss","Miscellaneous,Compilation","Far away from here, in a hidden gorge through the Mountian of the Golden Lion, lies the ofrgotten ABYSS. Forgotten, that is until now, when brave and sometimes foolhardy adventures strive to cross it. You are one of the elite band whose sole aim is to destroy the many evil monsters that lurk in the shadows, waiting for the next meal to come strolling across one of the many bridges in the ABYSS.","n/a","6.0","n/a","CCS","1984 ","http://www.gamefaqs.com/bbc/950134-abyss"
"Acheton","Adventure,Text","Acheton is an Adventure game, developed and published by Acornsoft,which was released in Europe in 1984.","n/a","n/a","n/a","Acornsoft","1984 ","http://www.gamefaqs.com/bbc/949285-acheton"
"Acorn Adventure","Adventure,Text","Acorn Adventure is an Adventure game, developed and published by CSL Microdata,which was released in Europe in 1983.","n/a","4.0","n/a","CSL Microdata","1983 ","http://www.gamefaqs.com/bbc/950156-acorn-adventure"
"Adventure","Adventure,Text","Adventure is an Adventure game, developed and published by Micro Power,which was released in Europe in 1983.","n/a","n/a","n/a","Micro Power","1983 ","http://www.gamefaqs.com/bbc/949661-adventure"
"Adventure 1: Secret River","Adventure,Text","Adventure 1: Secret River is an Adventure game, developed and published by Triffid Software Research,which was released in Europe in 1984.","n/a","n/a","n/a","Triffid Software Research","1984 ","http://www.gamefaqs.com/bbc/950676-adventure-1-secret-river"
"Adventure 2: Wizards Citadel","Adventure,Text","Adventure 2: Wizards Citadel is an Adventure game, developed and published by Triffid Software Research,which was released in Europe in 1984.","n/a","n/a","n/a","Triffid Software Research","1984 ","http://www.gamefaqs.com/bbc/950675-adventure-2-wizards-citadel"
"Adventureland","Adventure,Text","Adventureland is an Adventure game, developed and published by Adventuresoft UK Ltd,which was released in Europe in 1984.","n/a","n/a","n/a","Adventuresoft UK Ltd","1984 ","http://www.gamefaqs.com/bbc/951107-adventureland"
"Air Traffic Control Simulator","Simulation,General","Air Traffic Control Simulator is a Simulation game, developed and published by Hewson,which was released in Europe in 1983.","n/a","n/a","n/a","Hewson","1983 ","http://www.gamefaqs.com/bbc/950677-air-traffic-control-simulator"
"Airline","Strategy,Tycoon","Airline is a Strategy game, developed and published by CCS,which was released in Europe in 1983.","n/a","n/a","n/a","CCS","1983 ","http://www.gamefaqs.com/bbc/950135-airline"
"Alien 8","Adventure,General","Alien 8 uses the filmation process where the only limits are those of your imagination. Featuring three dimensional movement, materializing numbers and disappearing corridors. The animation is so good you will think you are really there.","n/a","9.0","n/a","Ultimate Play The Game","1985 ","http://www.gamefaqs.com/bbc/950441-alien-8"
"Alien Break In","Action,Shooter,Static","Alien Break In is an Action game, developed and published by Romik Software,which was released in Europe in 1983.","n/a","n/a","n/a","Romik Software","1983 ","http://www.gamefaqs.com/bbc/950327-alien-break-in"
"Alien Destroyers","Action,Shooter,Static","Alien Destroyers is an Action game, developed and published by Micro Power,which was released in Europe in 1982.","n/a","n/a","n/a","Micro Power","1982 ","http://www.gamefaqs.com/bbc/949662-alien-destroyers"
"Alien Dropout","Action,Shooter,Static","Alien Dropout is an Action game, developed and published by Superior Software,which was released in Europe in 1982.","n/a","n/a","n/a","Superior Software","1982 ","http://www.gamefaqs.com/bbc/949458-alien-dropout"
"Alien Swirl","Action,Shooter,Static","Alien Swirl is an Action game, developed and published by Micro Power,which was released in Europe in 1983.","n/a","n/a","n/a","Micro Power","1983 ","http://www.gamefaqs.com/bbc/949663-alien-swirl"
"Anarchy Zone","Action,Shooter,Static","Anarchy Zone is an Action game, developed and published by Atlantis Software,which was released in Europe in 1988.","n/a","n/a","n/a","Atlantis Software","1988 ","http://www.gamefaqs.com/bbc/950052-anarchy-zone"
"Android Attack","Action,General","Android Attack is an Action game, developed and published by Computer Concepts,which was released in Europe in 1983.","n/a","n/a","n/a","Computer Concepts","1983 ","http://www.gamefaqs.com/bbc/950157-android-attack"
"Apocalypse","Strategy,Wargame,Turn-Based","Apocalypse is a Strategy game, developed and published by Command Software,which was released in Europe in 1987.","n/a","n/a","n/a","Command Software","1987 ","http://www.gamefaqs.com/bbc/950158-apocalypse"
"Apollo","Simulation,Sci-Fi,Small Spaceship","Apollo is a Simulation game, developed and published by Software Invasion,which was released in Europe in 1983.","n/a","n/a","n/a","Software Invasion","1983 ","http://www.gamefaqs.com/bbc/950678-apollo"
"Arcade Action","Miscellaneous,Compilation","Arcade Action is a Miscellaneous game, developed and published by Acornsoft,which was released in Europe in 1982.","n/a","7.0","n/a","Acornsoft","1982 ","http://www.gamefaqs.com/bbc/949286-arcade-action"
"Arcade Soccer","Sports,Traditional,Soccer,Sim","Arcade Soccer is a Sports game, developed and published by 4th Dimension,which was released in Europe in 1989.","n/a","n/a","n/a","4th Dimension","1989 ","http://www.gamefaqs.com/bbc/950159-arcade-soccer"
"Arcadians","Action,Shooter,Static","Arcadians is an Action game, developed and published by Acornsoft,which was released in Europe in 1982.","n/a","n/a","n/a","Acornsoft","1982 ","http://www.gamefaqs.com/bbc/949287-arcadians"
"The Archers","Adventure,Text","If they put you in charge of The Archers, how would you change life in Ambridge? Here's your chance to find out. In this 4-part illustrated text game, you are the story editor, making the plot decisions. You're in charge, but you'll have to face the consequences of your decisions. They may cause a stir in The Bull - or in Broadcasting House. Watch out for memos from the Controller Radio 4 and see how you fare in the charts!","n/a","n/a","n/a","Level 9 Computing","1987 ","http://www.gamefaqs.com/bbc/950355-the-archers"
"Arena 3000","Action,Shooter,Static","Arena 3000 is an Action game, developed and published by MicroDeal,which was released in Europe in 1983.","n/a","n/a","n/a","MicroDeal","1983 ","http://www.gamefaqs.com/bbc/950227-arena-3000"
"Arkanoid","Action,General","&quot;The time and era of this story is unknown. After the mothership &quot;ARKANOID&quot; was destroyed, a spacecraft &quot;Vaus&quot; scrambled away from it. But only to be trapped in space warped by someone...&quot;Shatter the walls of the space system in 33 amazing rounds of a fight for survival! Control the &quot;Vaus&quot;, a space vessel that acts as your paddle, in an attempt to break all the colored bricks without the ball falling off the playing field. Break all the bricks to advance to the next challenging level, collecting power-ups along the way!","n/a","n/a","n/a","Imagine","1987 ","http://www.gamefaqs.com/bbc/950228-arkanoid"
"Around the World in 40 Screens","Miscellaneous,Puzzle,General","Around the World in 40 Screens is a Miscellaneous game, developed and published by Superior Software,which was released in Europe in 1987.","n/a","9.0","n/a","Superior Software","1987 ","http://www.gamefaqs.com/bbc/947259-around-the-world-in-40-screens"
"Asteroid Storm","Action,Shooter,Static","Asteroid Storm is an Action game, developed and published by Micro Power,which was released in Europe in 1982.","n/a","n/a","n/a","Micro Power","1982 ","http://www.gamefaqs.com/bbc/949664-asteroid-storm"
"Asteroids Deluxe","Action,Shooter,Static","This is the sequel to the infamous Atari&reg; classic, Asteroids&reg; where you must blast all the asteroids to pieces in the given time. Sounds familiar but this time there are deadly enemies such as UFOs and Killer Satellites, which will chase and shoot at you as you try to complete your quest. Use your shield to protect you against a fatal collision but use it sparingly as this shield will deplete every time your ship is hit. Help is at hand in the form of pickups, which will emerge from the debris of the destroyed asteroids. They can give you more blasting power and provide you with extra time to cope with the onslaught of attacks.Asteroids&reg; Deluxe&trade; contains all the action of the original and more with new and improved graphics, faster game play, dangerous enemies and as much master-blasting fun as you can handle. You only have 3 lives and a limited time - use it well!","n/a","n/a","n/a","Atari","1984 ","http://www.gamefaqs.com/bbc/950053-asteroids-deluxe"
"Astro Blaster","Action,Shooter,Static","Astro Blaster is an Action game, developed and published by Hitech Games Plus,which was released in Europe in 1984.","n/a","n/a","n/a","Hitech Games Plus","1984 ","http://www.gamefaqs.com/bbc/950679-astro-blaster"
"Astro Navigator","Simulation,Sci-Fi,Small Spaceship","Astro Navigator is a Simulation game, developed and published by Micro Power,which was released in Europe in 1982.","n/a","n/a","n/a","Micro Power","1982 ","http://www.gamefaqs.com/bbc/949665-astro-navigator"
"Astro Plumber","Action,General","Astro Plumber is an Action game, developed and published by Blue Ribbon,which was released in Europe in 1985.","n/a","n/a","n/a","Blue Ribbon","1985 ","http://www.gamefaqs.com/bbc/950136-astro-plumber"
"Atic Atac","Action,General","Atic Atac is an Action game, developed and published by Ultimate Play The Game,which was released in Europe in 1983.","n/a","7.0","n/a","Ultimate Play The Game","1983 ","http://www.gamefaqs.com/bbc/950442-atic-atac"
"Atlantis","Action,Shooter,Scrolling","Atlantis is an Action game, developed and published by Icon Software,which was released in Europe in 1982.","n/a","n/a","n/a","Icon Software","1982 ","http://www.gamefaqs.com/bbc/950680-atlantis"
"Atomic Protector","Action,General","Atomic Protector is an Action game, developed and published by Optima,which was released in Europe in 1983.","n/a","n/a","n/a","Optima","1983 ","http://www.gamefaqs.com/bbc/950387-atomic-protector"
"Attack On Alpha Centauri","Action,Shooter,Static","Attack On Alpha Centauri is an Action game, developed and published by Software Invasion,which was released in Europe in 1983.","n/a","6.0","n/a","Software Invasion","1983 ","http://www.gamefaqs.com/bbc/950422-attack-on-alpha-centauri"
"Auf Wiedersehen Pet","Action,General","Auf Wiedersehen Pet is an Action game, developed and published by Tynesoft,which was released in Europe in 1984.","n/a","n/a","n/a","Tynesoft","1984 ","http://www.gamefaqs.com/bbc/950443-auf-wiedersehen-pet"
"Aviator","Simulation,Flight,WWII","Aviator is a Simulation game, developed and published by Acornsoft,which was released in Europe in 1983.","n/a","n/a","n/a","Acornsoft","1983 ","http://www.gamefaqs.com/bbc/949288-aviator"
"Awari","Strategy,General","Awari is a Strategy game, developed and published by CSL Microdata,which was released in Europe in 1983.","n/a","n/a","n/a","CSL Microdata","1983 ","http://www.gamefaqs.com/bbc/950501-awari"
"Ballistix","Action,General","Sick of silly old soccer? Tired of pathetic pinball? Then you need a dose of Ballistix - the fastest, wackiest, toughest ball game yet to appear on a computer. Ballistix just explodes with excitement, puzzles and an amazing 130 different screens of frenetic action! The aim of the game is simple: score more goals than your opponent to win the match. Doing it is a different matter as splitters fill the screen with dozens of balls, tunnels hide them from view, bumpers bounce balls all over the show, fiendish red arrows speed them up to almost impossible velocity, magnets pull them away from your control, and much, much more. You can play against the computer or another player, set the speed if you can't stand the pace, define where the balls are fired and their velocity, rack up bonuses that will get you extra goals and then, at the end of an exhausting game, set your name in pride of place on the high-score table.","n/a","n/a","n/a","Superior Software","1989 ","http://www.gamefaqs.com/bbc/949459-ballistix"
"Balloon Buster","Miscellaneous,Puzzle,General","Buster the Clown enjoys a good laugh and something that gets him chuckling is bursting balloons. His latest challenge is to burst balloons in a set sequence. Unfortunately his colous blindness prevents him from getting a high schore. He needs help, your help. So do the red nose and join him in this hilarious balloon busting escapade!","n/a","n/a","n/a","Blue Ribbon","1989 ","http://www.gamefaqs.com/bbc/950137-balloon-buster"
"Banana Man","Action,General","Banana Man is an Action game, developed and published by MRM,which was released in Europe in 1983.","n/a","n/a","n/a","MRM","1983 ","http://www.gamefaqs.com/bbc/950681-banana-man"
"Bandit","Action,Shooter,Static","Bandit is an Action game, developed and published by Acornsoft,which was released in Europe in 1983.","n/a","n/a","n/a","Acornsoft","1983 ","http://www.gamefaqs.com/bbc/949289-bandit"
"Bandits","Action,Shooter,Static","Bandits is an Action game, developed and published by Oak,which was released in Europe in 1983.","n/a","n/a","n/a","Oak","1983 ","http://www.gamefaqs.com/bbc/950328-bandits"
"Bandits At 3 O'Clock","Simulation,Flight,WWII","Bandits At 3 O'Clock is a Simulation game, developed and published by Micro Power,which was released in Europe in 1983.","n/a","n/a","n/a","Micro Power","1983 ","http://www.gamefaqs.com/bbc/949666-bandits-at-3-oclock"
"Banjax","Adventure,General","Banjax is an Adventure game, developed and published by Robico,which was released in Europe in 1985.","n/a","n/a","n/a","Robico","1985 ","http://www.gamefaqs.com/bbc/950388-banjax"
"Bar Billiards","Sports,Alternative,Other","Bar Billiards is a Sports game, developed and published by Blue Ribbon,which was released in Europe in 1987.","n/a","n/a","n/a","Blue Ribbon","1987 ","http://www.gamefaqs.com/bbc/950138-bar-billiards"
"Barbarian","Action,General","Can you become Hegor the famous dragon-slaying, monster-mangling Barbarian? Are you the warrior who can enter the fearful realms of the underground world of Durgan, a world terrorized by the evil Necron? Can you handle the adventure, the frenzied attacks, the hidden traps, the gruesome death-dealing monsters? Your quest: to destroy the lair of the acursed Necron. Your prize: the kingdom's crown. Your task is awesome! You must live on your wits, conquer your innermost fears, and use every skill and weapon available to you. Hideous perils await. Can you survive?","n/a","6.0","n/a","Superior Software","1987 ","http://www.gamefaqs.com/bbc/949460-barbarian"
"Barbarian 2","Action,Fighting,2D","At the finale of BARBARIAN - THE ULTIMATE WARRIOR, the Barbarian defeated the warriors of Drax and thus saved Princess Mariana from his evil spell. Drax fled to the dungeons beneath his black castle, vowing to wreak disaster on the Jewelled Kingdom. There is only one way to stop Drax - the Barbarian and Mariana are the only two warriors skilled enough to survive the perilous journey to Drax's lair. Can you stop him? You must stop him!","n/a","6.0","n/a","Superior Software","1989 ","http://www.gamefaqs.com/bbc/949461-barbarian-2"
"Baron","Action,General","Baron is an Action game, developed and published by Superior Software,which was released in Europe in 1989.","n/a","n/a","n/a","Superior Software","1989 ","http://www.gamefaqs.com/bbc/949462-baron"
"Battle Of Britain","Simulation,Flight,WWII","Battle Of Britain is a Simulation game, developed and published by Betasoft,which was released in Europe in 1984.","n/a","n/a","n/a","Betasoft","1984 ","http://www.gamefaqs.com/bbc/950160-battle-of-britain"
"Battle Planet","Action,Shooter,Scrolling","Battle Planet is an Action game, developed and published by ISP,which was released in Europe in 1984.","n/a","n/a","n/a","ISP","1984 ","http://www.gamefaqs.com/bbc/950308-battle-planet"
"Battle Tank","Action,Shooter,First-Person,Tactical,Modern","Battle Tank is an Action game, developed and published by Superior Software,which was released in Europe in 1984.","n/a","5.0","n/a","Superior Software","1984 ","http://www.gamefaqs.com/bbc/949667-battle-tank"
"Battle Zone 2000","Strategy,Wargame,Turn-Based","Battle Zone 2000 is a Strategy game, developed and published by MC Lothlorien,which was released in Europe in 1983.","n/a","n/a","n/a","MC Lothlorien","1983 ","http://www.gamefaqs.com/bbc/950682-battle-zone-2000"
"BBC Bonanza","Miscellaneous,Compilation","BBC Bonanza is a Miscellaneous game, developed and published by Audiogenic Ltd.,which was released in Europe in 1987.","n/a","n/a","n/a","Audiogenic Ltd.","1987 ","http://www.gamefaqs.com/bbc/951108-bbc-bonanza"
"BBC Micro","Hardware,Console","BBC Micro is a Hardware game, developed and published by Acorn Computers Ltd,which was released in Europe in 1981.","n/a","8.0","n/a","Acorn Computers Ltd","1981 ","http://www.gamefaqs.com/bbc/946854-bbc-micro"
"BC Bill","Action,General","BC Bill is an Action game, developed and published by Imagine,which was released in Europe in 1984.","n/a","n/a","n/a","Imagine","1984 ","http://www.gamefaqs.com/bbc/950229-bc-bill"
"Beach Head","Action,General","Beach Head is an Action game, developed by Access Software and published by U.S. Gold,which was released in Europe in 1984.","n/a","n/a","n/a","Access Software","1984 ","http://www.gamefaqs.com/bbc/950444-beach-head"
"Beeb Beep","Miscellaneous,Puzzle,General","Beeb Beep is a Miscellaneous game, developed and published by IJK,which was released in Europe in 1982.","n/a","n/a","n/a","IJK","1982 ","http://www.gamefaqs.com/bbc/950230-beeb-beep"
"Beeb Munch","Action,General","Beeb Munch is an Action game, developed and published by IJK,which was released in Europe in 1982.","n/a","n/a","n/a","IJK","1982 ","http://www.gamefaqs.com/bbc/951109-beeb-munch"
"Beebgammon","Miscellaneous,Board Games","Beebgammon is a Miscellaneous game, developed and published by Bug-Byte,which was released in Europe in 1982.","n/a","n/a","n/a","Bug-Byte","1982 ","http://www.gamefaqs.com/bbc/949953-beebgammon"
"Beeline","Action,General","Beeline is an Action game, developed and published by Robico,which was released in Europe in 1985.","n/a","n/a","n/a","Robico","1985 ","http://www.gamefaqs.com/bbc/950389-beeline"
"Beverly Hills Cop","Action,General","Look out, Beverly Hills, here comes Axel Foley, the hero of Beverly Hills Cop and Beverly Hills Cop II, and this time he's going to stop the crime of the year, unless an army of trigger-happy gunmen stop him first. Fast and furious action from beginning to end!","n/a","n/a","n/a","Tynesoft","1990 ","http://www.gamefaqs.com/bbc/950446-beverly-hills-cop"
"The Big KO!","Sports,Traditional,Boxing","The Big KO! is a Sports game, developed and published by Tynesoft,which was released in Europe in 1987.","n/a","n/a","n/a","Tynesoft","1987 ","http://www.gamefaqs.com/bbc/950486-the-big-ko"
"Bird Strike","Action,Shooter,Static","Bird Strike is an Action game, developed and published by Firebird,which was released in Europe in 1981.","n/a","10.0","n/a","Firebird","1981 ","http://www.gamefaqs.com/bbc/950502-bird-strike"
"Birdie Barrage","Sports,Traditional,Golf,Sim","Birdie Barrage is a Sports game, developed and published by CDS Microsystems,which was released in Europe in 1983.","n/a","n/a","n/a","CDS Microsystems","1983 ","http://www.gamefaqs.com/bbc/950139-birdie-barrage"
"Birds Of Prey","Action,Shooter,Static","Birds Of Prey is an Action game, developed and published by Romik Software,which was released in Europe in 1983.","n/a","n/a","n/a","Romik Software","1983 ","http://www.gamefaqs.com/bbc/950329-birds-of-prey"
"Black Box","Strategy,General","Black Box is a Strategy game, developed and published by Acornsoft,which was released in Europe in 1984.","n/a","n/a","n/a","Acornsoft","1984 ","http://www.gamefaqs.com/bbc/949290-black-box"
"Black Queen","Miscellaneous,General","Black Queen is a Miscellaneous game, developed and published by BBC Software,which was released in Europe in 1987.","n/a","n/a","n/a","BBC Software","1987 ","http://www.gamefaqs.com/bbc/950054-black-queen"
"Blackjack","Miscellaneous,Parlor,Gambling","Blackjack is a Miscellaneous game, developed and published by Software Invasion,which was released in Europe in 1983.","n/a","n/a","n/a","Software Invasion","1983 ","http://www.gamefaqs.com/bbc/950683-blackjack"
"Blagger","Action,Platformer,2D","The most skillful house breaker of all time turns his attentions to the town of Umstrid, having successfully cleaned out its computer age predecessors. Can Roger the Dodger loot his way through an endless number of banks, shops, houses... a burglar's dream. The giant in his eye is not just sheer cheek, it's from the golden keys that he has to collect - but don't be too dazzled by the thought of amassed riches - round every corner in every passage danger lies in wait.","n/a","6.0","n/a","Alligata Software","1984 ","http://www.gamefaqs.com/bbc/949954-blagger"
"Blast!","Action,Shooter,Static","Blast! is an Action game, developed and published by Audiogenic Ltd.,which was released in Europe in 1989.","n/a","n/a","n/a","Audiogenic Ltd.","1989 ","http://www.gamefaqs.com/bbc/950055-blast"
"Blitzkrieg","Action,Shooter,Third-Person,Tactical,Modern","Blitzkrieg is an Action game, developed and published by Software Invasion,which was released in Europe in 1984.","n/a","n/a","n/a","Software Invasion","1984 ","http://www.gamefaqs.com/bbc/950421-blitzkrieg"
"Blockbusters","Miscellaneous,Trivia / Game Show","Blockbusters is a Miscellaneous game, developed and published by Macsen Software,which was released in Europe in 1985.","n/a","n/a","n/a","Macsen Software","1985 ","http://www.gamefaqs.com/bbc/950231-blockbusters"
"Blood of the Mutineers","Adventure,Text","Blood of the Mutineers is an Adventure game, developed and published by Robico,which was released in Europe in 1988.","n/a","n/a","n/a","Robico","1988 ","http://www.gamefaqs.com/bbc/950684-blood-of-the-mutineers"
"Blue Dragon 1983","Adventure,Text","Blue Dragon 1983 is an Adventure game, developed and published by MP Soft,which was released in Europe in 1983.","n/a","n/a","n/a","MP Soft","1983 ","http://www.gamefaqs.com/bbc/950390-blue-dragon-1983"
"Blue Dragon 1983","Adventure,Text","Blue Dragon 1983 is an Adventure game, developed and published by MP Soft,which was released in Europe in 1983.","n/a","n/a","n/a","MP Soft","1983 ","http://www.gamefaqs.com/bbc/950390-blue-dragon-1983"
"Blue Ribbon Games Disc 1","Miscellaneous,Compilation","Blue Ribbon Games Disc 1 is a Miscellaneous game, developed and published by Blue Ribbon,which was released in Europe in 1985.","n/a","n/a","n/a","Blue Ribbon","1985 ","http://www.gamefaqs.com/bbc/950784-blue-ribbon-games-disc-1"
"Blue Ribbon Games Disc 2","Miscellaneous,Compilation","Blue Ribbon Games Disc 2 is a Miscellaneous game, developed and published by Blue Ribbon,which was released in Europe in 1985.","n/a","n/a","n/a","Blue Ribbon","1985 ","http://www.gamefaqs.com/bbc/950785-blue-ribbon-games-disc-2"
"Blue Ribbon Games Disc 3","Miscellaneous,Compilation","Blue Ribbon Games Disc 3 is a Miscellaneous game, developed and published by Blue Ribbon,which was released in Europe in 1985.","n/a","n/a","n/a","Blue Ribbon","1985 ","http://www.gamefaqs.com/bbc/950786-blue-ribbon-games-disc-3"
"BMX on the Moon","Action,Shooter,Scrolling","BMX on the Moon is an Action game, developed and published by Superior Software,which was released in Europe in 1984.","n/a","n/a","n/a","Superior Software","1984 ","http://www.gamefaqs.com/bbc/949668-bmx-on-the-moon"
"Bobby Charlton Soccer","Sports,Traditional,Soccer,Sim","Bobby Charlton Soccer is a Sports game, developed and published by Dacc Ltd,which was released in Europe in 1985.","n/a","n/a","n/a","Dacc Ltd","1985 ","http://www.gamefaqs.com/bbc/950503-bobby-charlton-soccer"
"Boffin","Action,Platformer,2D","Boffin is an Action game, developed and published by Addictive Games,which was released in Europe in 1985.","n/a","n/a","n/a","Addictive Games","1985 ","http://www.gamefaqs.com/bbc/949955-boffin"
"Boffin 2","Action,Platformer,2D","Boffin 2 is an Action game, developed and published by Addictive Games,which was released in Europe in 1985.","n/a","n/a","n/a","Addictive Games","1985 ","http://www.gamefaqs.com/bbc/949959-boffin-2"
"Bone Cruncher","Action,General","Bone Cruncher is an Action game, developed and published by Superior Software,which was released in Europe in 1987.","n/a","7.0","n/a","Superior Software","1987 ","http://www.gamefaqs.com/bbc/949463-bone-cruncher"
"Bone Cruncher","Action,General","Bone Cruncher is an Action game, developed and published by Superior Software,which was released in Europe in 1987.","n/a","7.0","n/a","Superior Software","1987 ","http://www.gamefaqs.com/bbc/949463-bone-cruncher"
"Bored of the Rings","Adventure,Text","Bored of the Rings is an Adventure game, developed and published by Silversoft Ltd.,which was released in Europe in 1985.","n/a","n/a","n/a","Silversoft Ltd.","1985 ","http://www.gamefaqs.com/bbc/950330-bored-of-the-rings"
"Boris In The Underworld","Action,Shooter,Static","Boris In The Underworld is an Action game, developed and published by Superior Software,which was released in Europe in 1984.","n/a","n/a","n/a","Superior Software","1984 ","http://www.gamefaqs.com/bbc/949464-boris-in-the-underworld"
