"Title","Genres","Description","GameFAQs_Reader_Rating","GameFAQs_Rating","MetaCritics_MetaScore","Developer","ReleaseDate","ReferenceURL",
"Ravage","Action,Shooter,Static","Ravage is an Action game, developed and published by Blue Ribbon,which was released in Europe in 1985.","n/a","n/a","n/a","Blue Ribbon","1985 ","http://www.gamefaqs.com/bbc/950146-ravage"
"Ravenskull","Adventure,General","Ravenskull is an Adventure game, developed and published by Superior Software,which was released in Europe in 1987.","n/a","7.0","n/a","Superior Software","1987 ","http://www.gamefaqs.com/bbc/949511-ravenskull"
"Realm of Chaos - Village of Lost Souls","Adventure,Text","Realm of Chaos - Village of Lost Souls is an Adventure game, developed and published by Robico,which was released in Europe in 1987.","n/a","n/a","n/a","Robico","1987 ","http://www.gamefaqs.com/bbc/950409-realm-of-chaos-village-of-lost-souls"
"Rebel Planet","Adventure,Text","Rebel Planet is an Adventure game, developed and published by Adventuresoft UK Ltd,which was released in Europe in 1985.","n/a","n/a","n/a","Adventuresoft UK Ltd","1985 ","http://www.gamefaqs.com/bbc/950544-rebel-planet"
"Red Arrows","Simulation,Flight,Civilian Plane","It's the most exciting, full color flight simulator ever written for the home computer - and it uses every ounce of the micro's power to give the utmost realism to recreating the most spectacular aeronautical displays that have thrilled crowds at air shows for the last 21 years. The program comes with a 24 page detailed flight handbook that will soon help you take YOUR place alongside the ace pilots of the Red Arrows!","n/a","n/a","n/a","Database Software","1985 ","http://www.gamefaqs.com/bbc/950148-red-arrows"
"Red Moon","Adventure,Text","Red Moon is an Adventure game, developed and published by Level 9 Computing,which was released in Europe in 1985.","n/a","n/a","n/a","Level 9 Computing","1985 ","http://www.gamefaqs.com/bbc/949989-red-moon"
"Renegade Robots","Action,General","Renegade Robots is an Action game, developed and published by Senator Software,which was released in Europe in 1983.","n/a","n/a","n/a","Senator Software","1983 ","http://www.gamefaqs.com/bbc/950410-renegade-robots"
"Repton","Miscellaneous,Puzzle,General","Repton is a Miscellaneous game, developed and published by Superior Software,which was released in Europe in 1985.","n/a","8.5","n/a","Superior Software","1985 ","http://www.gamefaqs.com/bbc/947027-repton"
"Repton 2","Miscellaneous,Puzzle,General","Repton 2 is a Miscellaneous game, developed and published by Superior Software,which was released in Europe in 1985.","n/a","8.0","n/a","Superior Software","1985 ","http://www.gamefaqs.com/bbc/947028-repton-2"
"Repton 3","Action,General","Repton 3 is an Action game, developed and published by Superior Software,which was released in Europe in 1986.","n/a","9.0","n/a","Superior Software","1986 ","http://www.gamefaqs.com/bbc/947029-repton-3"
"Repton Infinity","Miscellaneous,Puzzle,General","Repton Infinity is a Miscellaneous game, developed and published by Superior Software,which was released in Europe in 1988.","n/a","8.0","n/a","Superior Software","1988 ","http://www.gamefaqs.com/bbc/949512-repton-infinity"
"Repton Thru Time","Miscellaneous,Puzzle,General","Repton Thru Time is a Miscellaneous game, developed and published by Superior Software,which was released in Europe in 1988.","n/a","9.0","n/a","Superior Software","1988 ","http://www.gamefaqs.com/bbc/949513-repton-thru-time"
"Return of R2","Action,General","Return of R2 is an Action game, developed and published by Blue Ribbon,which was released in Europe in 1987.","n/a","n/a","n/a","Blue Ribbon","1987 ","http://www.gamefaqs.com/bbc/950149-return-of-r2"
"Return to Eden","Adventure,Text","Return to Eden is an Adventure game, developed and published by Level 9 Computing,which was released in Europe in 1984.","n/a","n/a","n/a","Level 9 Computing","1984 ","http://www.gamefaqs.com/bbc/949990-return-to-eden"
"Revenge of Zor","Adventure,Text","Revenge of Zor is an Adventure game, developed and published by Kansas City,which was released in Europe in 1983.","n/a","n/a","n/a","Kansas City","1983 ","http://www.gamefaqs.com/bbc/950718-revenge-of-zor"
"Reversi","Miscellaneous,Board Games","Reversi is a Miscellaneous game, developed and published by Superior Software,which was released in Europe in 1983.","n/a","n/a","n/a","Superior Software","1983 ","http://www.gamefaqs.com/bbc/949515-reversi"
"Revs","Driving,Racing,Arcade","Revs is a Driving game, developed and published by Acornsoft,which was released in Europe in 1984.","n/a","10.0","n/a","Acornsoft","1984 ","http://www.gamefaqs.com/bbc/949318-revs"
"The Rick Hanson Trilogy","Adventure,Text","The Rick Hanson Trilogy is an Adventure game, developed and published by Robico,which was released in Europe in 1986.","n/a","8.0","n/a","Robico","1986 ","http://www.gamefaqs.com/bbc/950732-the-rick-hanson-trilogy"
"Ricochet","Action,General","Ricochet is an Action game, developed and published by Superior Software,which was released in Europe in 1989.","n/a","n/a","n/a","Superior Software","1989 ","http://www.gamefaqs.com/bbc/949516-ricochet"
"Rik the Roadie","Driving,Mission-based","Rik the Roadie is a Driving game, developed and published by Incentive Software,which was released in Europe in 1987.","n/a","n/a","n/a","Incentive Software","1987 ","http://www.gamefaqs.com/bbc/950719-rik-the-roadie"
"Rising of Salandra: The Prophecy","Adventure,Text","Rising of Salandra: The Prophecy is an Adventure game, developed and published by Larsoft,which was released in Europe in 1984.","n/a","n/a","n/a","Larsoft","1984 ","http://www.gamefaqs.com/bbc/950720-rising-of-salandra-the-prophecy"
"Road Runner","Driving,General","Road Runner is a Driving game, developed and published by Superior Software,which was released in Europe in 1983.","n/a","n/a","n/a","Superior Software","1983 ","http://www.gamefaqs.com/bbc/949517-road-runner"
"Robin of Sherwood","Adventure,Text","Robin of Sherwood is an Adventure game, developed and published by Adventuresoft UK Ltd,which was released in Europe in 1985.","n/a","n/a","n/a","Adventuresoft UK Ltd","1985 ","http://www.gamefaqs.com/bbc/951123-robin-of-sherwood"
"Robot Chase","Action,General","Robot Chase is an Action game, developed and published by Old Standard,which was released in Europe in 1982.","n/a","n/a","n/a","Old Standard","1982 ","http://www.gamefaqs.com/bbc/950412-robot-chase"
"Roboto","Action,Platformer,2D","Roboto is an Action game, developed and published by Bug-Byte,which was released in Europe in 1985.","n/a","n/a","n/a","Bug-Byte","1985 ","http://www.gamefaqs.com/bbc/949991-roboto"
"Robotron: 2084","Action,Shooter,Static","In 2084, man creates a species of super-advanced cyborgs known as Robotrons. Recognizing the imperfect nature of their creators, the Robotrons conclude that the inefficient human race must be exterminated. Only you and a single family of clones remain. If mankind is to survive, you must destroy the Grunts, Brains, Enforcers, and Tanks - but avoid the indestructible Hulks at all cost. Can you withstand wave after wave of android invasion... before it's too late?","n/a","n/a","n/a","Vid Kidz","1982 ","http://www.gamefaqs.com/bbc/950083-robotron-2084"
"Rocket Raid","Action,Shooter,Scrolling","Rocket Raid is an Action game, developed and published by Acornsoft,which was released in Europe in 1982.","n/a","8.0","n/a","Acornsoft","1982 ","http://www.gamefaqs.com/bbc/949319-rocket-raid"
"Rocky","Action,General","Rocky is an Action game, developed and published by Superior Software,which was released in Europe in 1983.","n/a","n/a","n/a","Superior Software","1983 ","http://www.gamefaqs.com/bbc/949518-rocky"
"Roman Empire","Strategy,Turn-Based,Historic","Roman Empire is a Strategy game, developed and published by MC Lothlorien,which was released in Europe in 1982.","n/a","n/a","n/a","MC Lothlorien","1982 ","http://www.gamefaqs.com/bbc/950721-roman-empire"
"Roulette","Miscellaneous,Parlor,Gambling","Roulette is a Miscellaneous game, developed and published by Micro Power,which was released in Europe in 1982.","n/a","n/a","n/a","Micro Power","1982 ","http://www.gamefaqs.com/bbc/949704-roulette"
"Roundheads","Strategy,Wargame,Turn-Based","Roundheads is a Strategy game, developed and published by MC Lothlorien,which was released in Europe in 1986.","n/a","n/a","n/a","MC Lothlorien","1986 ","http://www.gamefaqs.com/bbc/950722-roundheads"
"Rubble Trouble","Action,General","Rubble Trouble is an Action game, developed and published by Micro Power,which was released in Europe in 1983.","n/a","n/a","n/a","Micro Power","1983 ","http://www.gamefaqs.com/bbc/949705-rubble-trouble"
"Sabre Wulf","Adventure,General","Sabre Wulf is an Adventure game, developed and published by Ultimate Play The Game,which was released in Europe in 1984.","n/a","5.0","n/a","Ultimate Play The Game","1984 ","http://www.gamefaqs.com/bbc/950480-sabre-wulf"
"Sadim Castle","Adventure,Text","Sadim Castle is an Adventure game, developed and published by MP Soft,which was released in Europe in 1984.","n/a","n/a","n/a","MP Soft","1984 ","http://www.gamefaqs.com/bbc/950788-sadim-castle"
"Saigon","Action,Shooter,Scrolling","Saigon is an Action game, developed and published by Tynesoft,which was released in Europe in 1988.","n/a","n/a","n/a","Tynesoft","1988 ","http://www.gamefaqs.com/bbc/950479-saigon"
"SAS Commander","Action,Shooter,Static","SAS Commander is an Action game, developed and published by Comsoft,which was released in Europe in 1984.","n/a","n/a","n/a","Comsoft","1984 ","http://www.gamefaqs.com/bbc/950171-sas-commander"
"Savage Island Part 1","Adventure,Text","Savage Island Part 1 is an Adventure game, developed and published by Adventuresoft UK Ltd,which was released in Europe in 1984.","n/a","n/a","n/a","Adventuresoft UK Ltd","1984 ","http://www.gamefaqs.com/bbc/950545-savage-island-part-1"
"Savage Island Part 2","Adventure,Text","Savage Island Part 2 is an Adventure game, developed and published by Adventuresoft UK Ltd,which was released in Europe in 1984.","n/a","n/a","n/a","Adventuresoft UK Ltd","1984 ","http://www.gamefaqs.com/bbc/950546-savage-island-part-2"
"Savage Pond","Action,General","Savage Pond is an Action game, developed and published by Bug-Byte,which was released in Europe in 1983.","n/a","n/a","n/a","Bug-Byte","1983 ","http://www.gamefaqs.com/bbc/949992-savage-pond"
"Scan","Miscellaneous,General","Scan is a Miscellaneous game, developed and published by Paean,which was released in Europe in 1983.","n/a","n/a","n/a","Paean","1983 ","http://www.gamefaqs.com/bbc/950751-scan"
"Scapeghost","Adventure,Text","Scapeghost is an Adventure game, developed and published by Level 9 Computing,which was released in Europe in 1989.","n/a","n/a","n/a","Level 9 Computing","1989 ","http://www.gamefaqs.com/bbc/951124-scapeghost"
"Scrabble","Miscellaneous,Board Games","Scrabble is a Miscellaneous game, developed and published by Leisure Genius,which was released in Europe in 1984.","n/a","7.0","n/a","Leisure Genius","1984 ","http://www.gamefaqs.com/bbc/950272-scrabble"
"Screwball","Action,General","Screwball is an Action game, developed and published by MRM,which was released in Europe in 1984.","n/a","n/a","n/a","MRM","1984 ","http://www.gamefaqs.com/bbc/950411-screwball"
"Sea Adventure","Adventure,Text","Sea Adventure is an Adventure game, developed and published by Virgin Games,which was released in Europe in 1984.","n/a","n/a","n/a","Virgin Games","1984 ","http://www.gamefaqs.com/bbc/950723-sea-adventure"
"Sea Lord","Action,Shooter,Scrolling","Sea Lord is an Action game, developed and published by Bug-Byte,which was released in Europe in 1983.","n/a","n/a","n/a","Bug-Byte","1983 ","http://www.gamefaqs.com/bbc/949993-sea-lord"
"The Secret Diary of Adrian Mole","Action,General","The Secret Diary of Adrian Mole is an Action game, developed by Level 9 Computing and published by Mosaic,which was released in Europe in 1985.","n/a","6.0","n/a","Level 9 Computing","1985 ","http://www.gamefaqs.com/bbc/950353-the-secret-diary-of-adrian-mole"
"Secret Mission","Adventure,Text","Secret Mission is an Adventure game, developed and published by Adventuresoft UK Ltd,which was released in Europe in 1983.","n/a","n/a","n/a","Adventuresoft UK Ltd","1983 ","http://www.gamefaqs.com/bbc/950547-secret-mission"
"Secret Sam 1","Adventure,Text","Secret Sam 1 is an Adventure game, developed and published by MRM,which was released in Europe in 1983.","n/a","n/a","n/a","MRM","1983 ","http://www.gamefaqs.com/bbc/950724-secret-sam-1"
"Secret Sam 2","Adventure,Text","Secret Sam 2 is an Adventure game, developed and published by MRM,which was released in Europe in 1983.","n/a","n/a","n/a","MRM","1983 ","http://www.gamefaqs.com/bbc/950725-secret-sam-2"
"Seek","Adventure,Text","Seek is an Adventure game, developed and published by Micro Power,which was released in Europe in 1982.","n/a","n/a","n/a","Micro Power","1982 ","http://www.gamefaqs.com/bbc/949706-seek"
"Sentinel","Action,Shooter,Static","Sentinel is an Action game, developed and published by PSS,which was released in Europe in 1983.","n/a","7.0","n/a","PSS","1983 ","http://www.gamefaqs.com/bbc/950345-sentinel"
"The Sentinel","Strategy,General","Beyond your wildest dreams, in a world where the only force is pure energy, stands the Sentinel. Battle against him through 10,000 lands, in the most original, compelling and addictive computer game ever devised. Firebird issue the challenge, and the Sentinel awaits!","n/a","7.0","n/a","Firebird","1986 ","http://www.gamefaqs.com/bbc/950281-the-sentinel"
"The Seventh Star","Adventure,Text","The Seventh Star is an Adventure game, developed and published by Acornsoft,which was released in Europe in 1984.","n/a","n/a","n/a","Acornsoft","1984 ","http://www.gamefaqs.com/bbc/949327-the-seventh-star"
"Shanghai Warriors","Action,Beat-'Em-Up","Mercenaries led by the evil 'Snide Gantree' have stolen a US NAVY submarine, threatening to devastate the worlds capitals with its awesome arsenal of nuclear destruction. Only your skills and courage stand in his way! Do you have what it takes to meet this challenge?","n/a","n/a","n/a","Players","1989 ","http://www.gamefaqs.com/bbc/950346-shanghai-warriors"
"The Shrinking Professor's Quest","Adventure,Text","The Shrinking Professor's Quest is an Adventure game, developed and published by A&F Software,which was released in Europe in 1983.","n/a","n/a","n/a","A&F Software","1983 ","http://www.gamefaqs.com/bbc/950091-the-shrinking-professors-quest"
"Shuttle Simulator","Simulation,Sci-Fi,Small Spaceship","Shuttle Simulator is a Simulation game, developed and published by MicroDeal,which was released in Europe in 1983.","n/a","n/a","n/a","MicroDeal","1983 ","http://www.gamefaqs.com/bbc/950273-shuttle-simulator"
"SimCity","Strategy,City Building,Modern","SimCity is a Strategy game, developed by Superior Software and published by Infogrames,which was released in Europe in 1990.","n/a","7.0","n/a","Superior Software","1990 ","http://www.gamefaqs.com/bbc/949519-simcity"
"Sinbad","Action,General","Sinbad is an Action game, developed and published by Virgin Games,which was released in Europe in 1984.","n/a","n/a","n/a","Virgin Games","1984 ","http://www.gamefaqs.com/bbc/950481-sinbad"
"Sinistar","Action,Shooter,Scrolling","Sinistar is an Action game, developed by Williams and published by Atari,which was released in Europe in 1982.","n/a","n/a","n/a","Williams","1982 ","http://www.gamefaqs.com/bbc/950084-sinistar"
"Skyhawk","Simulation,Flight,Modern Jet","Skyhawk is a Simulation game, developed and published by Bug-Byte,which was released in Europe in 1986.","n/a","n/a","n/a","Bug-Byte","1986 ","http://www.gamefaqs.com/bbc/950548-skyhawk"
"Sliding-Block Puzzles","Miscellaneous,Puzzle,General","Sliding-Block Puzzles is a Miscellaneous game, developed and published by Acornsoft,which was released in Europe in 1982.","n/a","n/a","n/a","Acornsoft","1982 ","http://www.gamefaqs.com/bbc/949320-sliding-block-puzzles"
"Smash And Grab","Action,General","Smash And Grab is an Action game, developed and published by Superior Software,which was released in Europe in 1984.","n/a","n/a","n/a","Superior Software","1984 ","http://www.gamefaqs.com/bbc/949520-smash-and-grab"
"Snail Trail","Miscellaneous,Puzzle,General","Snail Trail is a Miscellaneous game, developed and published by RH Soft,which was released in Europe in 1983.","n/a","n/a","n/a","RH Soft","1983 ","http://www.gamefaqs.com/bbc/951125-snail-trail"
"Snake","Action,General","Snake is an Action game, developed and published by Computer Concepts,which was released in Europe in 1982.","n/a","5.0","n/a","Computer Concepts","1982 ","http://www.gamefaqs.com/bbc/950172-snake"
"Snapper","Action,General","Snapper is an Action game, developed and published by Acornsoft,which was released in Europe in 1983.","n/a","8.0","n/a","Acornsoft","1983 ","http://www.gamefaqs.com/bbc/947267-snapper"
"Snooker","Sports,General","Snooker is a Sports game, developed and published by Acornsoft,which was released in Europe in 1983.","n/a","5.0","n/a","Acornsoft","1983 ","http://www.gamefaqs.com/bbc/949321-snooker"
"Snowball","Adventure,Text","Snowball is an Adventure game, developed and published by Level 9 Computing,which was released in Europe in 1983.","n/a","n/a","n/a","Level 9 Computing","1983 ","http://www.gamefaqs.com/bbc/949994-snowball"
"Soccer Supremo","Sports,Traditional,Soccer,Sim","Soccer Supremo is a Sports game, developed and published by Qualsoft,which was released in Europe in 1984.","n/a","n/a","n/a","Qualsoft","1984 ","http://www.gamefaqs.com/bbc/950413-soccer-supremo"
"Son of Blagger","Action,Platformer,2D","Son of Blagger is an Action game, developed and published by Alligata Software,which was released in Europe in 1984.","n/a","n/a","n/a","Alligata Software","1984 ","http://www.gamefaqs.com/bbc/949995-son-of-blagger"
"Sorceror of Claymorgue Castle","Adventure,Text","Sorceror of Claymorgue Castle is an Adventure game, developed and published by Adventuresoft UK Ltd,which was released in Europe in 1984.","n/a","n/a","n/a","Adventuresoft UK Ltd","1984 ","http://www.gamefaqs.com/bbc/951126-sorceror-of-claymorgue-castle"
"Sorceror's Kingdom","Adventure,Text","Sorceror's Kingdom is an Adventure game, developed and published by Glengary,which was released in Europe in 1983.","n/a","n/a","n/a","Glengary","1983 ","http://www.gamefaqs.com/bbc/950320-sorcerors-kingdom"
"Southern Belle","Simulation,Train","Journey back to the glorious days of steam aboard the footplate of the powerful King Arthur class 4-6-0. Over 100 combinations of journey type, control level and schedule - plus a variety of tricky situations for those tackling the &quot;Problem Run&quot;.","n/a","n/a","n/a","Hewson","1985 ","http://www.gamefaqs.com/bbc/950274-southern-belle"
"Space Adventure","Adventure,Text","Space Adventure is an Adventure game, developed and published by Firstbyte,which was released in Europe in 1983.","n/a","n/a","n/a","Firstbyte","1983 ","http://www.gamefaqs.com/bbc/950314-space-adventure"
"Space Caverns","Simulation,Sci-Fi,Small Spaceship","Space Caverns is a Simulation game, developed and published by Tynesoft,which was released in Europe in 1985.","n/a","n/a","n/a","Tynesoft","1985 ","http://www.gamefaqs.com/bbc/950482-space-caverns"
"Space Fighter","Action,Shooter,Scrolling","Space Fighter is an Action game, developed and published by Superior Software,which was released in Europe in 1982.","n/a","n/a","n/a","Superior Software","1982 ","http://www.gamefaqs.com/bbc/949521-space-fighter"
"Space Guard","Action,Shooter,Static","Space Guard is an Action game, developed and published by MP Soft,which was released in Europe in 1983.","n/a","n/a","n/a","MP Soft","1983 ","http://www.gamefaqs.com/bbc/950789-space-guard"
"Space Hawk","Action,Shooter,Static","Space Hawk is an Action game, developed and published by Computer Concepts,which was released in Europe in 1982.","n/a","n/a","n/a","Computer Concepts","1982 ","http://www.gamefaqs.com/bbc/950549-space-hawk"
"Space Hi-Way","Action,General","Space Hi-Way is an Action game, developed and published by Amcom,which was released in Europe in 1983.","n/a","n/a","n/a","Amcom","1983 ","http://www.gamefaqs.com/bbc/950173-space-hi-way"
"Space Invaders","Action,Shooter,Static","Attention all Earthlings! Relentless alien hordes have been identified near you. Prevent the dangerous Space Invaders from landing on your territory. Use your cannon to defend against waves of descending alien invaders. Don't let them hit the ground or it's all over for you and the Earth! Destroy them and score points!","n/a","7.0","n/a","Bug-Byte","1982 ","http://www.gamefaqs.com/bbc/949996-space-invaders"
"Space Maze","Miscellaneous,Puzzle,General","Space Maze is a Miscellaneous game, developed and published by Micro Power,which was released in Europe in 1981.","n/a","n/a","n/a","Micro Power","1981 ","http://www.gamefaqs.com/bbc/949707-space-maze"
"Space Pilot","Action,Shooter,Scrolling","Space Pilot is an Action game, developed by Kingsoft and published by Superior Software,which was released in Europe in 1984.","n/a","n/a","n/a","Kingsoft","1984 ","http://www.gamefaqs.com/bbc/946953-space-pilot"
"Space Ranger","Action,Shooter,Scrolling","Space Ranger is an Action game, developed and published by Audiogenic Ltd.,which was released in Europe in 1986.","n/a","n/a","n/a","Audiogenic Ltd.","1986 ","http://www.gamefaqs.com/bbc/950085-space-ranger"
"Space Warp","Simulation,Sci-Fi,Large Spaceship","Space Warp is a Simulation game, developed and published by Bug-Byte,which was released in Europe in 1982.","n/a","n/a","n/a","Bug-Byte","1982 ","http://www.gamefaqs.com/bbc/949997-space-warp"
"Spaceman Sid","Action,Shooter,Scrolling","Spaceman Sid is an Action game, developed and published by English Software,which was released in Europe in 1984.","n/a","n/a","n/a","English Software","1984 ","http://www.gamefaqs.com/bbc/950275-spaceman-sid"
"Spectipede","Action,Shooter,Scrolling","Spectipede is an Action game, developed and published by Mastertronic,which was released in Europe in 1984.","n/a","n/a","n/a","Mastertronic","1984 ","http://www.gamefaqs.com/bbc/950276-spectipede"
"Spellbinder","Adventure,General","Spellbinder is an Adventure game, developed and published by Superior Software,which was released in Europe in 1987.","n/a","9.0","n/a","Superior Software","1987 ","http://www.gamefaqs.com/bbc/949522-spellbinder"
"Sphere Of Destiny","Action,General","Sphere Of Destiny is an Action game, developed and published by Audiogenic Ltd.,which was released in Europe in 1986.","n/a","n/a","n/a","Audiogenic Ltd.","1986 ","http://www.gamefaqs.com/bbc/950086-sphere-of-destiny"
"Sphere Of Destiny 2","Action,General","Sphere Of Destiny 2 is an Action game, developed and published by Audiogenic Ltd.,which was released in Europe in 1988.","n/a","n/a","n/a","Audiogenic Ltd.","1988 ","http://www.gamefaqs.com/bbc/950550-sphere-of-destiny-2"
"Sphinx Adventure","Adventure,Text","Sphinx Adventure is an Adventure game, developed and published by Acornsoft,which was released in Europe in 1982.","n/a","n/a","n/a","Acornsoft","1982 ","http://www.gamefaqs.com/bbc/949322-sphinx-adventure"
"Spitfire 40","Action,Flight","Spitfire '40 brings you back to Britain during the days when the German army was on the edge of France, preparing to cross the Channel. Hitler has ordered that the R.A.F. must be driven from the skies, and the Luftwaffe responded with all of its might. As a new volunteer, you have a few hours of flight training, the Spitfire Pilot's Notes and a ticket to the nearest aerodrome. Now is your opportunity to join the ranks of those who valiantly defended Great Britain from the Nazi juggernaut!","n/a","n/a","n/a","Mirrorsoft","1987 ","http://www.gamefaqs.com/bbc/950347-spitfire-40"
"Spitfire Command","Simulation,Flight,WWII","Spitfire Command is a Simulation game, developed and published by Superior Software,which was released in Europe in 1983.","n/a","n/a","n/a","Superior Software","1983 ","http://www.gamefaqs.com/bbc/949523-spitfire-command"
"Spooks And Spiders","Action,Platformer,2D","Spooks And Spiders is an Action game, developed and published by Software Invasion,which was released in Europe in 1984.","n/a","n/a","n/a","Software Invasion","1984 ","http://www.gamefaqs.com/bbc/950432-spooks-and-spiders"
"Spooksville","Action,General","Spooksville is an Action game, developed and published by Blue Ribbon,which was released in Europe in 1988.","n/a","n/a","n/a","Blue Ribbon","1988 ","http://www.gamefaqs.com/bbc/950150-spooksville"
"Spooky Manor","Adventure,Text","Spooky Manor is an Adventure game, developed and published by Acornsoft,which was released in Europe in 1983.","n/a","n/a","n/a","Acornsoft","1983 ","http://www.gamefaqs.com/bbc/949323-spooky-manor"
"Sporting Triangles","Miscellaneous,Trivia / Game Show","Sporting Triangles is a Miscellaneous game, developed and published by CDS Microsystems,which was released in Europe in 1989.","n/a","n/a","n/a","CDS Microsystems","1989 ","http://www.gamefaqs.com/bbc/950152-sporting-triangles"
"Spy Hunter","Driving,Racing,Arcade","Spy Hunter... considered armed and extremely dangerous. You control the turbo charged race car/hydro spy boat. You control a deadly arsenal of missiles, machine guns, oil slicks and smoke screens. Multiple nerve-shattering spy-action screens. Sophisticated spy-challenging graphics. This is hardly a game. It's a high-speed test of your secret agent skills. Meet the challenge and survive SPY HUNTER!","n/a","n/a","n/a","U.S. Gold","1983 ","http://www.gamefaqs.com/bbc/948137-spy-hunter"
"Spy Vs Spy","Strategy,General","Spy Vs Spy is a Strategy game, developed by First Star Software and published by Tynesoft,which was released in Europe in 1984.","n/a","6.0","n/a","First Star Software","1984 ","http://www.gamefaqs.com/bbc/950483-spy-vs-spy"
