"Title","Region","Genres","Description","GameFAQs_Reader_Rating","GameFAQs_Rating","MetaCritics_MetaScore","Developer","ReleaseDate","ReferenceURL"
"Extreme-G XG2","EU","Driving,Racing,Futuristic","Get ready for the ride of your life! Extreme-G 2. Feed the speedfreak within. Faster than the original. And ten times more deadly. One false turn and you're toast! Break the sound barrier with 12 razor-sharp handling evolution bikes. Over 40 twisting tracks. Blast your enemies with Rear-Firing Rockets, Ion Sidecannons, Magnetic Mines and more! Intense 4-player action: Battle Mode, Cup Challenge and Head-to-Head.","7.0","7.1","","Probe Entertainment Limited","Oct7, 1998 ","http://www.gamefaqs.com/n64/446010-extreme-g-2"
"Extreme-G 2","US","Driving,Racing,Futuristic","Get ready for the ride of your life! Extreme-G 2. Feed the speedfreak within. Faster than the original. And ten times more deadly. One false turn and you're toast! Break the sound barrier with 12 razor-sharp handling evolution bikes. Over 40 twisting tracks. Blast your enemies with Rear-Firing Rockets, Ion Sidecannons, Magnetic Mines and more! Intense 4-player action: Battle Mode, Cup Challenge and Head-to-Head.","7.0","7.1","","Probe Entertainment Limited","Oct7, 1998 ","http://www.gamefaqs.com/n64/446010-extreme-g-2"
"Extreme-G XG2","EU","Driving,Racing,Futuristic","Get ready for the ride of your life! Extreme-G 2. Feed the speedfreak within. Faster than the original. And ten times more deadly. One false turn and you're toast! Break the sound barrier with 12 razor-sharp handling evolution bikes. Over 40 twisting tracks. Blast your enemies with Rear-Firing Rockets, Ion Sidecannons, Magnetic Mines and more! Intense 4-player action: Battle Mode, Cup Challenge and Head-to-Head.","7.0","7.1","","Probe Entertainment Limited","Oct7, 1998 ","http://www.gamefaqs.com/n64/446010-extreme-g-2"
"F-1 Racing Sim","US","Driving,Racing,Formula One","F-1 Racing Sim is a Driving game, published by Ubisoft,which was cancelled before it was released.","","","","Ubisoft","Canceled ","http://www.gamefaqs.com/n64/574485-f-1-racing-sim"
"F-1 World Grand Prix","US","Driving,Racing,Formula One","F-1 World Grand Prix straps you into the driver's seat as you experience the high-octane rush of an actual Formula One season. Compete in the FIA Formula One World Championship with your choice of 22 drivers. You'll race through 17 of the most challenging Formula One circuits. Five game modes including: Grand Prix, Exhibition, Time Trial, Challenge and Two-Player. Realistic racing effects include real-time tire wear, skid marks and exhaust flames.","9.3","6.8","","Paradigm Entertainment","Jul 31, 1998 ","http://www.gamefaqs.com/n64/197275-f-1-world-grand-prix"
"F-1 World Grand Prix II","US","Driving,Racing,Formula One","F-1 World Grand Prix II is a Driving game, developed by Paradigm Entertainment and published by Nintendo,which was released in Europe in 1999.","9.0","7.3","","Paradigm Entertainment","Canceled ","http://www.gamefaqs.com/n64/197276-f-1-world-grand-prix-ii"
"F-Zero X","US","Driving,Racing,Futuristic","It's you against 29 other machines competing for the title of F-Zero X Champion. You're racing at speeds of over 1,000 km/h high above the atmosphere. Your competition comes from every corner of the galaxy and won't shed a tear at the thought of smashing you off the track. With four-player simultaneous gameplay and the Rumble Pak accessory, you have the fastest racing game on the N64 system!","8.5","8.1","85","Nintendo","Sep 30, 1998 ","http://www.gamefaqs.com/n64/197414-f-zero-x"
"F1 Pole Position 64","US","Driving,Racing,Formula One","Jump into the cockpit of an F1 racer and face the best teams in the world for a breathtaking race! Incredibly exciting: Official game of the FIA, the latest game from HUMAN will make your N64 roar through the 16 world championship circuits. From Monaco to San Marin, challenge the best drivers and feel the excitement of the World Grand Prix in 3D. 100% adrenalin! 2 arcade modes and a world championship mode which will help you experience a very realistic F1 simulation: settings of your vehicle, audio contact with the pit, changing weather conditions, collisions, retirement...","6.0","5.3","","Human Entertainment","Sep 30, 1997 ","http://www.gamefaqs.com/n64/197271-f1-pole-position-64"
"Human Grand Prix: New Generation","JP","Driving,Racing,Formula One","Jump into the cockpit of an F1 racer and face the best teams in the world for a breathtaking race! Incredibly exciting: Official game of the FIA, the latest game from HUMAN will make your N64 roar through the 16 world championship circuits. From Monaco to San Marin, challenge the best drivers and feel the excitement of the World Grand Prix in 3D. 100% adrenalin! 2 arcade modes and a world championship mode which will help you experience a very realistic F1 simulation: settings of your vehicle, audio contact with the pit, changing weather conditions, collisions, retirement...","6.0","5.3","","Human Entertainment","Sep 30, 1997 ","http://www.gamefaqs.com/n64/197271-f1-pole-position-64"
"F1 Racing Championship","US","Driving,Racing,Formula One","F1 Racing Championship is a Driving game, developed and published by Ubisoft,which was released in Europe in 2000.","n/a","7.3","n/a","Ubisoft","Dec8, 2000 ","http://www.gamefaqs.com/n64/577226-f1-racing-championship"
"Famista 64","US","Sports,Traditional,Baseball,Arcade","Famista 64 is a Sports game, developed and published by Namco,which was released in Japan in 1997.","n/a","7.0","","Namco","Nov 28, 1997 ","http://www.gamefaqs.com/n64/197291-famista-64"
"FIFA Soccer 64","US","Sports,Traditional,Soccer,Sim","EA SPORTS elevates the world's #1 interactive sports title to the next level with FIFA Soccer for the N64. 3D stadiums showcase quick and responsive motion captured players as you control their every pass and shot with the smoothness of an analog joystick. Real-time picture-in-picture allows you to play the action from two distinct view points, perfect for fast-paced gameplay. Featuring 22 fully rendered players, 6 leagues including 160 teams, and Tournament, Playoff, Friendly, and League modes.","8.0","4.9","","EA Canada","Feb 28, 1997 ","http://www.gamefaqs.com/n64/197313-fifa-soccer-64"
"FIFA 64","EU","Sports,Traditional,Soccer,Sim","EA SPORTS elevates the world's #1 interactive sports title to the next level with FIFA Soccer for the N64. 3D stadiums showcase quick and responsive motion captured players as you control their every pass and shot with the smoothness of an analog joystick. Real-time picture-in-picture allows you to play the action from two distinct view points, perfect for fast-paced gameplay. Featuring 22 fully rendered players, 6 leagues including 160 teams, and Tournament, Playoff, Friendly, and League modes.","8.0","4.9","","EA Canada","Feb 28, 1997 ","http://www.gamefaqs.com/n64/197313-fifa-soccer-64"
"FIFA 99","US","Sports,Traditional,Soccer,Sim","All the clubs, leagues, and cups! Over 250 club teams. Twleve leagues: USA, Spain, Brazil, Italy, England, France, Germany, Sweden, Scotland, Portugal, Belgium, and the Netherlands. Custom Cups and Leagues - play your way! European Dream League mode - challenge the best of the best. New slide shots, new semi-auto goalkeepers, dazzling skill moves, new lifelike head tracking, new traps and tackles!","7.2","6.8","","EA Canada","Nov 30, 1998 ","http://www.gamefaqs.com/n64/197309-fifa-99"
"FIFA Soccer 64","US","Sports,Traditional,Soccer,Sim","EA SPORTS elevates the world's #1 interactive sports title to the next level with FIFA Soccer for the N64. 3D stadiums showcase quick and responsive motion captured players as you control their every pass and shot with the smoothness of an analog joystick. Real-time picture-in-picture allows you to play the action from two distinct view points, perfect for fast-paced gameplay. Featuring 22 fully rendered players, 6 leagues including 160 teams, and Tournament, Playoff, Friendly, and League modes.","8.0","4.9","","EA Canada","Feb 28, 1997 ","http://www.gamefaqs.com/n64/197313-fifa-soccer-64"
"FIFA 64","EU","Sports,Traditional,Soccer,Sim","EA SPORTS elevates the world's #1 interactive sports title to the next level with FIFA Soccer for the N64. 3D stadiums showcase quick and responsive motion captured players as you control their every pass and shot with the smoothness of an analog joystick. Real-time picture-in-picture allows you to play the action from two distinct view points, perfect for fast-paced gameplay. Featuring 22 fully rendered players, 6 leagues including 160 teams, and Tournament, Playoff, Friendly, and League modes.","8.0","4.9","","EA Canada","Feb 28, 1997 ","http://www.gamefaqs.com/n64/197313-fifa-soccer-64"
"FIFA: Road to World Cup 98","US","Sports,Traditional,Soccer,Sim","Conquer fierce defenders and defeat entire nations on your quest to compete in World Cup 98. Featuring 172 International teams from 6 zones and 16 International stadiums. Responsive player and ball control. New motion captured players and moves. Detailed stats for over 4500 players. 5 ways to compete: World Cup 98, Friendly, League, Penalty Kick Shootout and Training Mode. Edit teams and players to create your own dream team.","8.5","7.0","","EA Canada","Nov 30, 1997 ","http://www.gamefaqs.com/n64/197311-fifa-road-to-world-cup-98"
"FIFA: Road to World Cup 98 - World Cup e no Michi","JP","Sports,Traditional,Soccer,Sim","Conquer fierce defenders and defeat entire nations on your quest to compete in World Cup 98. Featuring 172 International teams from 6 zones and 16 International stadiums. Responsive player and ball control. New motion captured players and moves. Detailed stats for over 4500 players. 5 ways to compete: World Cup 98, Friendly, League, Penalty Kick Shootout and Training Mode. Edit teams and players to create your own dream team.","8.5","7.0","","EA Canada","Nov 30, 1997 ","http://www.gamefaqs.com/n64/197311-fifa-road-to-world-cup-98"
"FIFA: Road to World Cup 98","US","Sports,Traditional,Soccer,Sim","Conquer fierce defenders and defeat entire nations on your quest to compete in World Cup 98. Featuring 172 International teams from 6 zones and 16 International stadiums. Responsive player and ball control. New motion captured players and moves. Detailed stats for over 4500 players. 5 ways to compete: World Cup 98, Friendly, League, Penalty Kick Shootout and Training Mode. Edit teams and players to create your own dream team.","8.5","7.0","","EA Canada","Nov 30, 1997 ","http://www.gamefaqs.com/n64/197311-fifa-road-to-world-cup-98"
"FIFA: Road to World Cup 98 - World Cup e no Michi","JP","Sports,Traditional,Soccer,Sim","Conquer fierce defenders and defeat entire nations on your quest to compete in World Cup 98. Featuring 172 International teams from 6 zones and 16 International stadiums. Responsive player and ball control. New motion captured players and moves. Detailed stats for over 4500 players. 5 ways to compete: World Cup 98, Friendly, League, Penalty Kick Shootout and Training Mode. Edit teams and players to create your own dream team.","8.5","7.0","","EA Canada","Nov 30, 1997 ","http://www.gamefaqs.com/n64/197311-fifa-road-to-world-cup-98"
"Fighter Destiny 2","US","Action,Fighting,3D","Enter the arena and do battle with the toughest, most skilled martial arts experts on the planet. As one of the international fighting elite, you'll vie to become the true authority of hand-to-hand combat. Your destiny awaits. Defeat any of your 11 opponents and gain their abilities. Launch 5 different modes of attack, from Training to Record Attack. Adjust scoring, ring sizes and difficulty settings. Compete in points-based martial arts tournaments. Force your opponent to relive defeat in instant replay. Gain new abilities and skills when you face the Master in the Fighter's Arena.","6.7","6.5","54","Opus","Jul 14, 2000 ","http://www.gamefaqs.com/n64/197326-fighter-destiny-2"
"Kakutou Denshou: F-Cup Maniax","JP","Action,Fighting,3D","Enter the arena and do battle with the toughest, most skilled martial arts experts on the planet. As one of the international fighting elite, you'll vie to become the true authority of hand-to-hand combat. Your destiny awaits. Defeat any of your 11 opponents and gain their abilities. Launch 5 different modes of attack, from Training to Record Attack. Adjust scoring, ring sizes and difficulty settings. Compete in points-based martial arts tournaments. Force your opponent to relive defeat in instant replay. Gain new abilities and skills when you face the Master in the Fighter's Arena.","6.7","6.5","54","Opus","Jul 14, 2000 ","http://www.gamefaqs.com/n64/197326-fighter-destiny-2"
"Fighters Destiny","US","Action,Fighting,3D","Defeat the Masters of the Fight in a head-on bout of power and skill. Fighters Destiny demands everything you have, everything you are and throws it right back at you in truly amazing, unstoppable 3D action. Prepare to fight every step of the way as you master the moves and unlock the secrets to fulfill your ultimate destiny!","6.7","6.6","","Opus","Jan 31, 1998 ","http://www.gamefaqs.com/n64/197325-fighters-destiny"
"Fighting Cup","JP","Action,Fighting,3D","Defeat the Masters of the Fight in a head-on bout of power and skill. Fighters Destiny demands everything you have, everything you are and throws it right back at you in truly amazing, unstoppable 3D action. Prepare to fight every step of the way as you master the moves and unlock the secrets to fulfill your ultimate destiny!","6.7","6.6","","Opus","Jan 31, 1998 ","http://www.gamefaqs.com/n64/197325-fighters-destiny"
"Fighters Destiny","US","Action,Fighting,3D","Defeat the Masters of the Fight in a head-on bout of power and skill. Fighters Destiny demands everything you have, everything you are and throws it right back at you in truly amazing, unstoppable 3D action. Prepare to fight every step of the way as you master the moves and unlock the secrets to fulfill your ultimate destiny!","6.7","6.6","","Opus","Jan 31, 1998 ","http://www.gamefaqs.com/n64/197325-fighters-destiny"
"Fighting Cup","JP","Action,Fighting,3D","Defeat the Masters of the Fight in a head-on bout of power and skill. Fighters Destiny demands everything you have, everything you are and throws it right back at you in truly amazing, unstoppable 3D action. Prepare to fight every step of the way as you master the moves and unlock the secrets to fulfill your ultimate destiny!","6.7","6.6","","Opus","Jan 31, 1998 ","http://www.gamefaqs.com/n64/197325-fighters-destiny"
"Fighting Force 64","US","Action,Beat-'Em-Up","Fighting Force delivers unparalleled action and tons of attack moves in a fully progressive 3D environment. Smash through an anti-tank barricade, pick up a rocket launcher and torch incoming enemies or knock over a vending machine or fuel tanker to find hidden weapons!","6.0","6.0","","Core Design Ltd.","Apr 30, 1999 ","http://www.gamefaqs.com/n64/197332-fighting-force-64"
"Flying Dragon","US","Action,Fighting,3D","Two games in one: Flying Dragon is the ONE and ONLY game that will entertain the entire family. Create your ideal fighting game using the most customizable interface yet offered. Choose between RPG-style and 'virtual' tournament combat. Flying Dragon is never the same game twice! Over 20 different characters and 200 different items. Save your characters on a Controller Pak and play them against your friends!","7.9","7.4","","Culture Brain","Jul 31, 1998 ","http://www.gamefaqs.com/n64/197363-flying-dragon"
"Hiryu No Ken Twin","JP","Action,Fighting,3D","Two games in one: Flying Dragon is the ONE and ONLY game that will entertain the entire family. Create your ideal fighting game using the most customizable interface yet offered. Choose between RPG-style and 'virtual' tournament combat. Flying Dragon is never the same game twice! Over 20 different characters and 200 different items. Save your characters on a Controller Pak and play them against your friends!","7.9","7.4","","Culture Brain","Jul 31, 1998 ","http://www.gamefaqs.com/n64/197363-flying-dragon"
"Forsaken 64","US","Action,General","An experiment gone wrong ripped away the earth's atmosphere. Bathed in the searching radiation of the sun, the planet has been condemned. You are among the FORSAKEN few who invade the now abandoned settlements to collect what little fortune was left behind.","8.0","6.3","75","Iguana Entertainment","Apr 30, 1998 ","http://www.gamefaqs.com/n64/197377-forsaken-64"
"Forsaken","EU","Action,General","An experiment gone wrong ripped away the earth's atmosphere. Bathed in the searching radiation of the sun, the planet has been condemned. You are among the FORSAKEN few who invade the now abandoned settlements to collect what little fortune was left behind.","8.0","6.3","75","Iguana Entertainment","Apr 30, 1998 ","http://www.gamefaqs.com/n64/197377-forsaken-64"
"Forsaken 64","US","Action,General","An experiment gone wrong ripped away the earth's atmosphere. Bathed in the searching radiation of the sun, the planet has been condemned. You are among the FORSAKEN few who invade the now abandoned settlements to collect what little fortune was left behind.","8.0","6.3","75","Iguana Entertainment","Apr 30, 1998 ","http://www.gamefaqs.com/n64/197377-forsaken-64"
"Forsaken","EU","Action,General","An experiment gone wrong ripped away the earth's atmosphere. Bathed in the searching radiation of the sun, the planet has been condemned. You are among the FORSAKEN few who invade the now abandoned settlements to collect what little fortune was left behind.","8.0","6.3","75","Iguana Entertainment","Apr 30, 1998 ","http://www.gamefaqs.com/n64/197377-forsaken-64"
"Fox Sports College Hoops '99","US","Sports,Traditional,Basketball,Sim","Complete college basketball license featuring over 120 college teams. NCAA Tournament, NCAA Sweet 16 and Final Four. Pre-season and Conference tournaments. In-depth player attributes and skill ratings. Three difficulty levels, easy to learn controls, and multiple camera angles. Authentic college basketball look and feel with real logos, uniforms and home courts, and real college offensive and defensive plays.","1.0","5.4","","Z-Axis, Ltd.","Oct 31, 1998 ","http://www.gamefaqs.com/n64/197380-fox-sports-college-hoops-99"
"World Cup 98","US","Sports,Traditional,Soccer,Sim","Win the World - For Your Country! All 32 World Cup France 98 qualifying teams: Take your team, with all your favorite players, to the World Cup Final and win it all. NEW! World Cup Classics: Play 8 of the all-time most thrilling World Cup Final matches. NEW! On-the-fly in-game management: Alter attacking strategy and formation at the press of a button. NEW! On-the-fly in-game tactics: Run preset plays at critical points in the game.","8.5","6.3","","EA Canada","May 18, 1998 ","http://www.gamefaqs.com/n64/199325-world-cup-98"
"Copa del Mundo: Francia 98","EU","Sports,Traditional,Soccer,Sim","Win the World - For Your Country! All 32 World Cup France 98 qualifying teams: Take your team, with all your favorite players, to the World Cup Final and win it all. NEW! World Cup Classics: Play 8 of the all-time most thrilling World Cup Final matches. NEW! On-the-fly in-game management: Alter attacking strategy and formation at the press of a button. NEW! On-the-fly in-game tactics: Run preset plays at critical points in the game.","8.5","6.3","","EA Canada","May 18, 1998 ","http://www.gamefaqs.com/n64/199325-world-cup-98"
"Coupe du Monde 98","EU","Sports,Traditional,Soccer,Sim","Win the World - For Your Country! All 32 World Cup France 98 qualifying teams: Take your team, with all your favorite players, to the World Cup Final and win it all. NEW! World Cup Classics: Play 8 of the all-time most thrilling World Cup Final matches. NEW! On-the-fly in-game management: Alter attacking strategy and formation at the press of a button. NEW! On-the-fly in-game tactics: Run preset plays at critical points in the game.","8.5","6.3","","EA Canada","May 18, 1998 ","http://www.gamefaqs.com/n64/199325-world-cup-98"
"Frankreich 98: Die Fussball-WM","EU","Sports,Traditional,Soccer,Sim","Win the World - For Your Country! All 32 World Cup France 98 qualifying teams: Take your team, with all your favorite players, to the World Cup Final and win it all. NEW! World Cup Classics: Play 8 of the all-time most thrilling World Cup Final matches. NEW! On-the-fly in-game management: Alter attacking strategy and formation at the press of a button. NEW! On-the-fly in-game tactics: Run preset plays at critical points in the game.","8.5","6.3","","EA Canada","May 18, 1998 ","http://www.gamefaqs.com/n64/199325-world-cup-98"
"Fushigi no Dungeon: Fuurai no Shiren 2 - Oni Shuurai! Shiren Jou!","US","Role-Playing,General","Fushigi no Dungeon: Fuurai no Shiren 2 - Oni Shuurai! Shiren Jou! is a Role-Playing game, developed and published by ChunSoft,which was released in Japan in 2000.","9.0","8.2","n/a","ChunSoft","Sep 27, 2000 ","http://www.gamefaqs.com/n64/577498-fushigi-no-dungeon-fuurai-no-shiren-2-oni-shuurai"
"Deadly Arts","US","Action,Fighting,3D","Walk into the arena, take a bow, and prepare for the most intense combat simulation ever! Over nine controllable fighters are yours to command, complete with an arsenal of face-busting, body-smashing moves. Feel every kick, punch and throw with the RUMBLE PAK feature as you take part in a low down and dirty street fighting tournament!","4.5","5.5","","Konami Computer Entertainment Osaka","Oct7, 1998 ","http://www.gamefaqs.com/n64/197070-deadly-arts"
"G.A.S.P!!: Fighter's NEXTream ","JP","Action,Fighting,3D","Walk into the arena, take a bow, and prepare for the most intense combat simulation ever! Over nine controllable fighters are yours to command, complete with an arsenal of face-busting, body-smashing moves. Feel every kick, punch and throw with the RUMBLE PAK feature as you take part in a low down and dirty street fighting tournament!","4.5","5.5","","Konami Computer Entertainment Osaka","Oct7, 1998 ","http://www.gamefaqs.com/n64/197070-deadly-arts"
"G.A.S.P!!: Fighter's NEXTream ","EU","Action,Fighting,3D","Walk into the arena, take a bow, and prepare for the most intense combat simulation ever! Over nine controllable fighters are yours to command, complete with an arsenal of face-busting, body-smashing moves. Feel every kick, punch and throw with the RUMBLE PAK feature as you take part in a low down and dirty street fighting tournament!","4.5","5.5","","Konami Computer Entertainment Osaka","Oct7, 1998 ","http://www.gamefaqs.com/n64/197070-deadly-arts"
"Goemon's Great Adventure","US","Action,Platformer,2D","Goemon and all his friends are back in his greatest adventure yet! Goemon's Great Adventure combines classic Goemon platform action with an all-new twist. The evil time-traveling nun, Bismaru, has summoned Dochuki, a demon prince, to take over the Earth. But first, she wants to marry him! Can Goemon and his gang stop the demon? Can Dochuki escape the cloying clutches of the wacked-out nun? Will Ebisu ever beat his own dumpling eating record? It's an adventure you'll never forget!","8.9","8.0","","Konami Computer Entertainment Osaka","Sep 15, 1999 ","http://www.gamefaqs.com/n64/915334-goemons-great-adventure"
"Mystical Ninja Starring Goemon 2","EU","Action,Platformer,2D","Goemon and all his friends are back in his greatest adventure yet! Goemon's Great Adventure combines classic Goemon platform action with an all-new twist. The evil time-traveling nun, Bismaru, has summoned Dochuki, a demon prince, to take over the Earth. But first, she wants to marry him! Can Goemon and his gang stop the demon? Can Dochuki escape the cloying clutches of the wacked-out nun? Will Ebisu ever beat his own dumpling eating record? It's an adventure you'll never forget!","8.9","8.0","","Konami Computer Entertainment Osaka","Sep 15, 1999 ","http://www.gamefaqs.com/n64/915334-goemons-great-adventure"
"Ganbare Goemon: Derodero Douchu Obake Tenkomori","JP","Action,Platformer,2D","Goemon and all his friends are back in his greatest adventure yet! Goemon's Great Adventure combines classic Goemon platform action with an all-new twist. The evil time-traveling nun, Bismaru, has summoned Dochuki, a demon prince, to take over the Earth. But first, she wants to marry him! Can Goemon and his gang stop the demon? Can Dochuki escape the cloying clutches of the wacked-out nun? Will Ebisu ever beat his own dumpling eating record? It's an adventure you'll never forget!","8.9","8.0","","Konami Computer Entertainment Osaka","Sep 15, 1999 ","http://www.gamefaqs.com/n64/915334-goemons-great-adventure"
"Mystical Ninja starring Goemon","US","Action,General","A giant UFO has appeared over Oedo Castle, and the Mystical Ninja is off to save the world again! Control Goemon and his giant robot, Impact, Ebisimaru, a truly twisted ninja, Yae, the part-time militant mermaid, and Sasuke, a mechanical warrior. This brave band must travel from town to town, collecting information and purchasing helpful items in their quest to defeat the dreaded Peach Mountain Shoguns.","8.6","8.3","67","Konami Computer Entertainment Osaka","Apr 16, 1998 ","http://www.gamefaqs.com/n64/198022-mystical-ninja-starring-goemon"
"Ganbare Goemon: Neo Momoyama Bakufu no Odori","JP","Action,General","A giant UFO has appeared over Oedo Castle, and the Mystical Ninja is off to save the world again! Control Goemon and his giant robot, Impact, Ebisimaru, a truly twisted ninja, Yae, the part-time militant mermaid, and Sasuke, a mechanical warrior. This brave band must travel from town to town, collecting information and purchasing helpful items in their quest to defeat the dreaded Peach Mountain Shoguns.","8.6","8.3","67","Konami Computer Entertainment Osaka","Apr 16, 1998 ","http://www.gamefaqs.com/n64/198022-mystical-ninja-starring-goemon"
