"Title","Region","Genres","Description","GameFAQs_Reader_Rating","GameFAQs_Rating","MetaCritics_MetaScore","Developer","ReleaseDate","ReferenceURL"
"Rush 2: Extreme Racing","EU","Driving,Racing,Arcade","Performance... Adrenaline... Speed! These are the ingredients in the next generation of Rush Mania! Feel the Rush once again as you blast through some of the hottest spots in America! You want death-defying jumps and treacherous shortcuts? You'll find 'em, along with much more, in 8 new venues! Time to polish your speed demon driving skills! You'll be smokin' the radar guns in places like Las Vegas, New York City, Hawaii, Los Angeles and Seattle. And of course, there's that garden spot known as Alcatraz Island. Yeah, we're talkin' about The Rock.","8.6","7.3","","Atari Games (Midway)","Nov 10, 1998 ","http://www.gamefaqs.com/n64/198527-rush-2-extreme-racing-usa"
"Rush 2: Extreme Racing USA","US","Driving,Racing,Arcade","Performance... Adrenaline... Speed! These are the ingredients in the next generation of Rush Mania! Feel the Rush once again as you blast through some of the hottest spots in America! You want death-defying jumps and treacherous shortcuts? You'll find 'em, along with much more, in 8 new venues! Time to polish your speed demon driving skills! You'll be smokin' the radar guns in places like Las Vegas, New York City, Hawaii, Los Angeles and Seattle. And of course, there's that garden spot known as Alcatraz Island. Yeah, we're talkin' about The Rock.","8.6","7.3","","Atari Games (Midway)","Nov 10, 1998 ","http://www.gamefaqs.com/n64/198527-rush-2-extreme-racing-usa"
"Rush 2: Extreme Racing","EU","Driving,Racing,Arcade","Performance... Adrenaline... Speed! These are the ingredients in the next generation of Rush Mania! Feel the Rush once again as you blast through some of the hottest spots in America! You want death-defying jumps and treacherous shortcuts? You'll find 'em, along with much more, in 8 new venues! Time to polish your speed demon driving skills! You'll be smokin' the radar guns in places like Las Vegas, New York City, Hawaii, Los Angeles and Seattle. And of course, there's that garden spot known as Alcatraz Island. Yeah, we're talkin' about The Rock.","8.6","7.3","","Atari Games (Midway)","Nov 10, 1998 ","http://www.gamefaqs.com/n64/198527-rush-2-extreme-racing-usa"
"S.C.A.R.S.","US","Driving,Racing,Arcade","Untamed racing in the ultimate killer cars! Nine brutal 3D tracks across volcanoes, jungles, oceans and more. Nine killer cars armed with missiles, time bombs, boomerangs and more. Night and rain racing. Challenge, Grand Prix, and Custom Cup racing! Two and four player racing.","3.0","6.1","","Vivid Image","Dec4, 1998 ","http://www.gamefaqs.com/n64/198533-scars"
"S.C.A.R.S.","US","Driving,Racing,Arcade","Untamed racing in the ultimate killer cars! Nine brutal 3D tracks across volcanoes, jungles, oceans and more. Nine killer cars armed with missiles, time bombs, boomerangs and more. Night and rain racing. Challenge, Grand Prix, and Custom Cup racing! Two and four player racing.","3.0","6.1","","Vivid Image","Dec4, 1998 ","http://www.gamefaqs.com/n64/198533-scars"
"Saikyou Habu Shogi","US","Miscellaneous,Board Games","Saikyou Habu Shogi is a Miscellaneous game, developed and published by Seta Corporation,which was released in Japan in 1996.","n/a","5.0","n/a","Seta Corporation","Jun 23, 1996 ","http://www.gamefaqs.com/n64/574530-saikyou-habu-shogi"
"San Francisco Rush 2049","US","Driving,Racing,Futuristic","San Francisco Rush 2049 - The original arcade racing hit now with three action-packed games in one! Race Mode: Scream through futuristic San Francisco tracks. Stunt Mode: Insane air and gravity-defying tricks. Battle Mode: Lock and load your way through eight killer battle arenas. Also featuring 19 all-new tracks and 13 selectable cars, with all-new customization! New and improved graphics and vehicle physics. Experience and 'feel' the RUSH!","9.3","7.5","86","Midway","Sep7, 2000 ","http://www.gamefaqs.com/n64/198529-san-francisco-rush-2049"
"San Francisco Rush: Extreme Racing","US","Driving,Racing,Arcade","Put the pedal to the metal, smoke the tires, and pour on the speed with San Francisco Rush! Hit the road in one of eight unique race cars ranked in four distinct performance classes. Burn rubber through the 3D modeled hills and landmarks of San Francisco. Choose from six accurately detailed tracks that can be adjusted with the games 'Mirror' or 'Backwards' options for a total of 24 incredible tracks! Spectacular hidden shortcuts on each track! Realistic sensation of catching air and landing hard - supports N64 Rumble Pak!","8.3","7.0","","Atari Games (Midway)","Nov8, 1997 ","http://www.gamefaqs.com/n64/198546-san-francisco-rush-extreme-racing"
"Scooby-Doo! Classic Creep Capers","US","Adventure,General","Like wow! Scooby and the gang face off against some all-time classic villains, including The Witch Doctor, The Black Knight, and The Snow Ghost. Help guide Scooby and the gang through three classic episodes and one all-new episode. It's your job to search for clues and unmask the ghoulish villains!","3.0","5.2","53","Terraglyph Interactive Studios","Mar1, 2001 ","http://www.gamefaqs.com/n64/374845-scooby-doo-classic-creep-capers"
"SD Hiryu no Ken Densetsu","US","Action,Fighting,3D","SD Hiryu no Ken Densetsu is an Action game, developed and published by Culture Brain,which was released in Japan in 1999.","n/a","8.0","n/a","Culture Brain","Jan 29, 1999 ","http://www.gamefaqs.com/n64/576685-sd-hiryu-no-ken-densetsu"
"Sesame Street: Elmo's Letter Adventure","US","Miscellaneous,Edutainment","Preschoolers are in for a wonderful alphabet-packed good time. Join Elmo and his Sesame Street pals in wonderful 3D action adventures as he swims, drives, and blasts off into a vibrantly colored world of video game fun! Helps children ages 3 - 6 with letter recognition and basic spelling skills. Three skill levels easily adjustable by parent or child. Features voices from the beloved TV show.","3.0","6.3","","Realtime Associates","Nov 15, 1999 ","http://www.gamefaqs.com/n64/929169-sesame-street-elmos-letter-adventure"
"Sesame Street: Elmo's Number Journey","US","Miscellaneous,Edutainment","Preschoolers are in for a wonderful number-packed good time. Explore magical worlds with Elmo and his Sesame Street friends as he snowboards, jetskis, and drives off on an exciting video game adventure! Helps children ages 3 - 6 with number recognition and basic math skills. Three skill levels easily adjustable by parent or child. Features voices from the beloved TV show.","4.0","5.8","n/a","Realtime Associates","Nov 30, 1999 ","http://www.gamefaqs.com/n64/915907-sesame-street-elmos-number-journey"
"Shadow Man","US","Action Adventure,Horror","He is coming, stalking criminals in spirit world and real world. A possessed man is coming, a voodoo mask in his chest and lines of power in his back. Shadow Man is coming. Trailing evil from Liveside to Deadside. To stop an apocalypse. To save your soul.","9.1","7.2","","Acclaim Studios Teeside","Jul 31, 1999 ","http://www.gamefaqs.com/n64/198601-shadow-man"
"Shadowgate 64: Trials of the Four Towers","US","Adventure,First-Person,Fantasy","An ancient evil stirs. Reaching from beyond the grave, it warps the minds of men who would release it. Soon, very soon, the dreaded Warlock Lord will again be unleashed upon the land. This time there is no one to stop it. No one except for an unfortunate Halfling, caught in the middle of the cataclysmic events events unfolding within the ruins of Castle Shadowgate... This all-new adventure catapults you back into the world of the award-wining computer and NES masterpiece. A magical world now surrounding you in full 3D splendor. A world of wonder, which beckons you to unravel its mysteries.","6.6","7.0","","Infinite Ventures","May 31, 1999 ","http://www.gamefaqs.com/n64/198608-shadowgate-64-trials-of-the-four-towers"
"Shadowgate Rising","US","Adventure,First-Person,Fantasy","Shadowgate Rising is an Adventure game, developed by Infinite Ventures and published by Kemco,which was cancelled before it was released.","","","","Infinite Ventures","Canceled ","http://www.gamefaqs.com/n64/672666-shadowgate-rising"
"Shin Nippon Pro Wrestling: Toukon Road - Brave Spirits","US","Action,Fighting,Wrestling","Shin Nippon Pro Wrestling: Toukon Road - Brave Spirits is an Action game, developed by Yuke's and published by Hudson,which was released in Japan in 1998.","n/a","8.2","n/a","Yuke's","Jan4, 1998 ","http://www.gamefaqs.com/n64/574540-shin-nippon-pro-wrestling-toukon-road-brave"
"Shin Nippon Pro Wrestling: Toukon Road 2 - The Next Generation","US","Action,Fighting,Wrestling","Shin Nippon Pro Wrestling: Toukon Road 2 - The Next Generation is an Action game, developed by Yuke's and published by Hudson,which was released in Japan in 1998.","n/a","9.0","n/a","Yuke's","Dec 26, 1998 ","http://www.gamefaqs.com/n64/574672-shin-nippon-pro-wrestling-toukon-road-2-the-next"
"SimCity 2000","US","Strategy,City Building,Modern","SimCity 2000 puts an entire city in the palm of your hand.SimCity 2000 lets you create, build, and run a city of your own.Take on the role as a mayor and call the shots for the entire city.You'll have to keep up on the housing, industries, mass transportation, and commerce to attract potential citizens.And just when you think you have it under control, a natural disaster or alien invasion may occur to set you back.However, if you can conquer all of these problems, you just might be able to turn a small town into a thriving metropolis.","n/a","7.3","","Genki","Jan 30, 1998 ","http://www.gamefaqs.com/n64/574532-simcity-2000"
"Sin and Punishment: Successor of the Earth","US","Action,Shooter,Rail","Sin and Punishment: Successor of the Earth is an Action game, developed by Treasure and published by Nintendo,which was released in Japan in 2000.","8.9","8.2","","Treasure","Oct1, 2007 ","http://www.gamefaqs.com/n64/366184-sin-and-punishment-successor-of-the-earth"
"Tsumi to Batsu: Hoshi no Keishousha","JP","Action,Shooter,Rail","Sin and Punishment: Successor of the Earth is an Action game, developed by Treasure and published by Nintendo,which was released in Japan in 2000.","8.9","8.2","","Treasure","Oct1, 2007 ","http://www.gamefaqs.com/n64/366184-sin-and-punishment-successor-of-the-earth"
"Sin and Punishment ","EU","Action,Shooter,Rail","Sin and Punishment: Successor of the Earth is an Action game, developed by Treasure and published by Nintendo,which was released in Japan in 2000.","8.9","8.2","","Treasure","Oct1, 2007 ","http://www.gamefaqs.com/n64/366184-sin-and-punishment-successor-of-the-earth"
"Sin and Punishment ","US","Action,Shooter,Rail","Sin and Punishment: Successor of the Earth is an Action game, developed by Treasure and published by Nintendo,which was released in Japan in 2000.","8.9","8.2","","Treasure","Oct1, 2007 ","http://www.gamefaqs.com/n64/366184-sin-and-punishment-successor-of-the-earth"
"Sin and Punishment: Successor of the Earth","US","Action,Shooter,Rail","Sin and Punishment: Successor of the Earth is an Action game, developed by Treasure and published by Nintendo,which was released in Japan in 2000.","8.9","8.2","","Treasure","Oct1, 2007 ","http://www.gamefaqs.com/n64/366184-sin-and-punishment-successor-of-the-earth"
"Tsumi to Batsu: Hoshi no Keishousha","JP","Action,Shooter,Rail","Sin and Punishment: Successor of the Earth is an Action game, developed by Treasure and published by Nintendo,which was released in Japan in 2000.","8.9","8.2","","Treasure","Oct1, 2007 ","http://www.gamefaqs.com/n64/366184-sin-and-punishment-successor-of-the-earth"
"Sin and Punishment ","EU","Action,Shooter,Rail","Sin and Punishment: Successor of the Earth is an Action game, developed by Treasure and published by Nintendo,which was released in Japan in 2000.","8.9","8.2","","Treasure","Oct1, 2007 ","http://www.gamefaqs.com/n64/366184-sin-and-punishment-successor-of-the-earth"
"Sin and Punishment ","US","Action,Shooter,Rail","Sin and Punishment: Successor of the Earth is an Action game, developed by Treasure and published by Nintendo,which was released in Japan in 2000.","8.9","8.2","","Treasure","Oct1, 2007 ","http://www.gamefaqs.com/n64/366184-sin-and-punishment-successor-of-the-earth"
"Snowboard Kids","US","Sports,Alternative,Snowboarding","Rip it up on nine courses worth of various terrain! Pull over 36 big air tricks in your quest for the ultimate deck. And with Rumble Pak compatibility, you'll definitely feel it if you stick those maneuvers or not! Featuring five characters, each with unique moves, five modes of play, including pipes, four-player battle races, and nine customizable beginning boards.","7.9","7.4","","Racdym","February 1998 ","http://www.gamefaqs.com/n64/366874-snowboard-kids"
"Snobow Kids","JP","Sports,Alternative,Snowboarding","Rip it up on nine courses worth of various terrain! Pull over 36 big air tricks in your quest for the ultimate deck. And with Rumble Pak compatibility, you'll definitely feel it if you stick those maneuvers or not! Featuring five characters, each with unique moves, five modes of play, including pipes, four-player battle races, and nine customizable beginning boards.","7.9","7.4","","Racdym","February 1998 ","http://www.gamefaqs.com/n64/366874-snowboard-kids"
"Big Mountain 2000","US","Sports,Alternative,Snowboarding","The king of all mountains wants some face time with you! Face-off on your choice of either snowboard or skis. Nasty hills, turns and jumps help you shred the laws of gravity as you Freestyle it, Solo or compete against other snowhounds. Ready to challenge the Big Mountain? Three modes - Time Attack, 2-Player Battle, and Championship - with 3 styles of play - Free Ride, Slalom and Giant Slalom. Six characters of wildly varying skill levels to choose from. Design your own gear, including equipment and clothing.","2.0","6.3","61","Natsume","Oct 10, 2000 ","http://www.gamefaqs.com/n64/196757-big-mountain-2000"
"Snow Speeder","JP","Sports,Alternative,Snowboarding","The king of all mountains wants some face time with you! Face-off on your choice of either snowboard or skis. Nasty hills, turns and jumps help you shred the laws of gravity as you Freestyle it, Solo or compete against other snowhounds. Ready to challenge the Big Mountain? Three modes - Time Attack, 2-Player Battle, and Championship - with 3 styles of play - Free Ride, Slalom and Giant Slalom. Six characters of wildly varying skill levels to choose from. Design your own gear, including equipment and clothing.","2.0","6.3","61","Natsume","Oct 10, 2000 ","http://www.gamefaqs.com/n64/196757-big-mountain-2000"
"Snowboard Kids","US","Sports,Alternative,Snowboarding","Rip it up on nine courses worth of various terrain! Pull over 36 big air tricks in your quest for the ultimate deck. And with Rumble Pak compatibility, you'll definitely feel it if you stick those maneuvers or not! Featuring five characters, each with unique moves, five modes of play, including pipes, four-player battle races, and nine customizable beginning boards.","7.9","7.4","","Racdym","February 1998 ","http://www.gamefaqs.com/n64/366874-snowboard-kids"
"Snobow Kids","JP","Sports,Alternative,Snowboarding","Rip it up on nine courses worth of various terrain! Pull over 36 big air tricks in your quest for the ultimate deck. And with Rumble Pak compatibility, you'll definitely feel it if you stick those maneuvers or not! Featuring five characters, each with unique moves, five modes of play, including pipes, four-player battle races, and nine customizable beginning boards.","7.9","7.4","","Racdym","February 1998 ","http://www.gamefaqs.com/n64/366874-snowboard-kids"
"Snowboard Kids 2","US","Sports,Alternative,Snowboarding","Just when you thought it was safe to hit the slopes... Here comes those kids to tear it up again in the outrageous sequel, Snowboard Kids 2. However, all is not well in Snow Town. Enter Damien, the mischievous little brat from the underworld... and he'll stop at nothing to ruin the fun of our Snowboard Kids. It's up to you and the rest of the Snowboard Kids to defeat the evil Damien!","9.1","8.1","","Racdym","Mar2, 1999 ","http://www.gamefaqs.com/n64/198684-snowboard-kids-2"
"Chou Snobow Kids","JP","Sports,Alternative,Snowboarding","Just when you thought it was safe to hit the slopes... Here comes those kids to tear it up again in the outrageous sequel, Snowboard Kids 2. However, all is not well in Snow Town. Enter Damien, the mischievous little brat from the underworld... and he'll stop at nothing to ruin the fun of our Snowboard Kids. It's up to you and the rest of the Snowboard Kids to defeat the evil Damien!","9.1","8.1","","Racdym","Mar2, 1999 ","http://www.gamefaqs.com/n64/198684-snowboard-kids-2"
"Aero Fighters Assault","US","Simulation,Flight,Modern Jet","The AeroFighters Assault team needs your help to save the Earth from the evil Phutta Morgana and their machines of doom. Engage a variety of enemy aircraft and boss characters around the globe in multiple missions. Join the battle in the only game that matters!","8.4","6.4","","Paradigm Entertainment","Oct 30, 1997 ","http://www.gamefaqs.com/n64/196549-aero-fighters-assault"
"Sonic Wings Assault","JP","Simulation,Flight,Modern Jet","The AeroFighters Assault team needs your help to save the Earth from the evil Phutta Morgana and their machines of doom. Engage a variety of enemy aircraft and boss characters around the globe in multiple missions. Join the battle in the only game that matters!","8.4","6.4","","Paradigm Entertainment","Oct 30, 1997 ","http://www.gamefaqs.com/n64/196549-aero-fighters-assault"
"South Park","US","Action,Shooter,First-Person,Modern","A giant comet is heading toward South Park and it's up to you to save them! Beware of anal-probing aliens, big evil clones, and demented turkeys. It's the only game big enough for Cartman's big fat ass. Sweet environments without any lame, tree-hugging hippies. Play as all your favorite South Park characters. Authentic voices from South Park, including Isaac Hayes as Chef. Howdy-ho your way through mega four-player action!","5.1","6.0","","Iguana Entertainment","Dec 12, 1998 ","http://www.gamefaqs.com/n64/198710-south-park"
"South Park Rally","US","Driving,Racing,Kart","Get drivin' with your bad self! Face off against Cartman, Grandpa, Scuzzlebutt, Starvin' Marvin and the rest of South Park in the wildest, raunchiest road race ever. Loaded with dozens of insane vehicles and sweet custom sound-bites! Break like the wind with Terrance and Phillip! Honk if you're packin' sweet pick-ups!","4.5","5.9","","Tantalus Interactive","Feb 29, 2000 ","http://www.gamefaqs.com/n64/198713-south-park-rally"
"South Park: Chef's Luv Shack","US","Action,General","It's one big multi-player luv-in! All your favorite South Park characters are waiting for you at Chef's Luv Shack. Spreading the hot buttered game lovin' with dozens of crazy mini-games. Testing your South Park knowledge with outrageous trivia questions. And telling it like it is with insane sound-bites! Featuring authentic voices from South Park including Isaac Hayes as Chef!","6.0","5.7","","Acclaim Studios Austin","Oct 31, 1999 ","http://www.gamefaqs.com/n64/198717-south-park-chefs-luv-shack"
"Dark Rift","US","Action,Fighting,3D","Dark Rift delivers hyper-active 3D fighting with a sci-fi theme! Compete against eight exotic and powerful characters and two very large bosses. Motion captured character animations enhance the realism. The arsenal includes multiple-hit combos, back-crunching grabs, juggles, projectiles, and punishing special moves. Tune into individual character stereo sound tracking. Fight in Tournament, 2-Player or Training modes.","4.0","5.8","","Kronos Digital Entertainment","Jun 30, 1997 ","http://www.gamefaqs.com/n64/197049-dark-rift"
"Space Dynamites","JP","Action,Fighting,3D","Dark Rift delivers hyper-active 3D fighting with a sci-fi theme! Compete against eight exotic and powerful characters and two very large bosses. Motion captured character animations enhance the realism. The arsenal includes multiple-hit combos, back-crunching grabs, juggles, projectiles, and punishing special moves. Tune into individual character stereo sound tracking. Fight in Tournament, 2-Player or Training modes.","4.0","5.8","","Kronos Digital Entertainment","Jun 30, 1997 ","http://www.gamefaqs.com/n64/197049-dark-rift"
"Space Invaders","US","Action,Shooter,Static","Attention all Earthlings!Relentless alien hordes have been identified near you.Be aware - the classic arcade update has proven to be even more dangerously addictive than ever before.Space Invaders skyrockets the legendary arcade franchise to new heights with out-of-this-world 3D graphics, explosive special effects, enhanced firepower, high-resolution cinematics, and frenetic multiplayer modes in graphically rich space worlds.Classic Arcade Action: Brave 100 levels of classic shoot-and-dodge-style gameplay now in 3D and updated with a host of innovative features!Visit a variety of space worlds, including Pluto, Saturn, Mars, and Earth-each with dynamic terrain and interactive background elements.","8.0","6.6","","Z-Axis, Ltd.","Nov 30, 1999 ","http://www.gamefaqs.com/n64/198723-space-invaders"
"Space Station Silicon Valley","US","Action,Platformer,3D","Silicon Valley was intended to be the most technologically advanced amusement park civilization has ever known. Shortly after take-off, it disappeared. Now, in the year 3000, it's back and on a collision course with Earth! It's up to you to conquer the 30 levels in four incredibly lavish environments, take control of the totally original, wacky and - at times - life threatening characters and unlock the mysteries of the Valley. It's all great fun but remember, the fate of the world is in your hands!","8.8","7.6","83","DMA Design","Oct 21, 1998 ","http://www.gamefaqs.com/n64/198727-space-station-silicon-valley"
"Spider-Man","US","Action Adventure,Sci-Fi","He spins a web, swings across the sky and lands with a somersault onto the Daily Bugle building. Who is this masked hero? It's you! Fight, jump and web-sling as Spider-Man as you take on a legion of sinister villains. The city is depending on you.","7.9","7.2","72","Edge of Reality","Nov 21, 2000 ","http://www.gamefaqs.com/n64/366269-spider-man"
"Star Fox 64","US","Action,Shooter,Rail","The Lylat system has been invaded! Join Fox McCloud and his Star Fox team as they fight to save the galaxy from the clutches of the evil Andross. Travel to many different 3-D worlds. Battle the enemy in the air and on the ground and listen in as Fox McCloud interacts with a cast of characters.","8.2","8.6","88","Nintendo","Jul1, 1997 ","http://www.gamefaqs.com/n64/198759-star-fox-64"
"Lylat Wars ","EU","Action,Shooter,Rail","The Lylat system has been invaded! Join Fox McCloud and his Star Fox team as they fight to save the galaxy from the clutches of the evil Andross. Travel to many different 3-D worlds. Battle the enemy in the air and on the ground and listen in as Fox McCloud interacts with a cast of characters.","8.2","8.6","88","Nintendo","Jul1, 1997 ","http://www.gamefaqs.com/n64/198759-star-fox-64"
"Lylat Wars ","AU","Action,Shooter,Rail","The Lylat system has been invaded! Join Fox McCloud and his Star Fox team as they fight to save the galaxy from the clutches of the evil Andross. Travel to many different 3-D worlds. Battle the enemy in the air and on the ground and listen in as Fox McCloud interacts with a cast of characters.","8.2","8.6","88","Nintendo","Jul1, 1997 ","http://www.gamefaqs.com/n64/198759-star-fox-64"
"Star Soldier: Vanishing Earth","US","Action,Shooter,Scrolling","In the year 2098 mankind had been critically attacked by a military force from Zeograd, a hostile planet in a far off galaxy. Commander Parker Deehan of Special Interception Airforce (SIA) decided to deploy and pilot the F98 Star Soldier fighter craft into the front line of battle against Zeograd. Losing the battle meant the extinction of mankind and the total annihilation of Earth!","6.3","6.8","","Hudson Soft","Dec 15, 1998 ","http://www.gamefaqs.com/n64/562857-star-soldier-vanishing-earth"
"Jet Force Gemini","US","Action,Shooter,Third-Person,Sci-Fi","The insect invasion has begun... The galaxy is being infested by the evil Mizar and his horde of Drones. Already, the planet of Goldwood has been subjugated and the peaceful Tribals enslaved. With an arsenal of mega-weapons at their disposal, the Jet Force Gemini team must travel in search of Mizar's lair - rescuing Tribals and splattering Drones all along the way. But can Juno, Vela and their faithful dog, Lupus, exterminate the deadly threat before it's too late?","8.9","7.9","80","Rare Ltd.","Sep 30, 1999 ","http://www.gamefaqs.com/n64/197682-jet-force-gemini"
"Star Twins","JP","Action,Shooter,Third-Person,Sci-Fi","The insect invasion has begun... The galaxy is being infested by the evil Mizar and his horde of Drones. Already, the planet of Goldwood has been subjugated and the peaceful Tribals enslaved. With an arsenal of mega-weapons at their disposal, the Jet Force Gemini team must travel in search of Mizar's lair - rescuing Tribals and splattering Drones all along the way. But can Juno, Vela and their faithful dog, Lupus, exterminate the deadly threat before it's too late?","8.9","7.9","80","Rare Ltd.","Sep 30, 1999 ","http://www.gamefaqs.com/n64/197682-jet-force-gemini"
